Review Id,User Name,Review,Rating,Date of Review,reviewCreatedVersion
fd13b0c1-d170-4aa4-b4be-4ef13c809539,En Google-bruker,Easy to enter exact position when in need. This should be easily accessible.,5,09-08-2013,1.5
3d8dc86a-1aec-4744-8bac-714a7b76dc18,En Google-bruker,"I paid approx. NOK 17 when I loaded this brilliant app. Now it's free. Of course, the amount means nothing. This is the most sensible app I have on my Android. Hope I never have to use it. Merry Christmas and a Happy New Year to all of you in the Norwegian Air Ambulance. Greetings Paal",2,06-07-2013,1.5
0ab149ee-952d-4bce-ad36-a210247cae3f,En Google-bruker,Now it has searched for days without finding my position. Good thing I haven't been in need...,5,14-06-2013,1.5
741b5323-a0b3-480f-8fc9-19423924be97,En Google-bruker,Brilliant app.,4,14-06-2013,1.5
a9518bf9-7d39-43c6-a0ed-11e98b3b45c3,En Google-bruker,"Really good app, won't be without it ;-) you should never say never. Suddenly you are in a situation where you need this. ;-) Better yet ;-) Ps: I hope I never have to use it.",5,13-06-2013,1.5
3a595f11-2c66-4fe0-929b-4a38c9405d3c,En Google-bruker,Good prediction to have,5,08-06-2013,1.5
e304f0df-9b54-4654-ad5a-593688653762,En Google-bruker,"For me, who drives a lot around the country in a motor home, it is very reassuring to have this App available in case something happens to me or others.",3,05-06-2013,1.5
3e64a79a-61ed-4816-b46c-65e52eeabcf0,En Google-bruker,Good app:) Hope I don't have to use it... My father forced me to download it. I might get around to thanking him one day:,5,23-04-2013,1
12353bd7-57d9-4812-bcfc-a1eecae8c01d,En Google-bruker,,5,10-03-2013,1
618b6a44-bc92-4e63-9849-5a0f477ea56b,En Google-bruker,Too inaccurate. Gets a given position which is several blocks away.,5,21-01-2013,1
17f47836-77e7-419d-a336-93247de66410,En Google-bruker,Correct address is: Glimmerveien 29,5,24-12-2012,1
d55c1ae7-0fbc-433a-9617-442de9bdceda,En Google-bruker,"As others have pointed out, the app must be able to activate GPS automatically, important to reduce the number of clicks in an emergency situation.",5,12-12-2012,1
d86b9f59-1831-4c3c-b0e9-e02aab4e5743,En Google-bruker,"An update of the street number is required. For army there have been new house numbers for a long time now, while on the app it is the old ones.",1,27-11-2012,1
d4b26be0-60f3-4417-97d7-36a8188440a8,En Google-bruker,Could be a little more accurate. I'm probably at the neighbour's place.,5,25-11-2012,1
0d123e16-358d-42ba-bcfc-12af9e0632d8,En Google-bruker,Very good,5,16-11-2012,1
a10f60f5-03f4-44b5-873c-e8910462893e,En Google-bruker,An excellent idea to locate where you are when you call for help.,5,14-11-2012,1
6abeb6e6-affe-4050-81d6-dd1ff08d04aa,En Google-bruker,Very good application this saves lives,5,14-11-2012,1
a14d2697-6575-44fc-9472-e9a14b5427e3,En Google-bruker,Actually a must have app when you are at the cabin and the like.,5,08-11-2012,1
fdd9f434-faff-4388-ad61-e4bc19cef1fd,En Google-bruker,I hope this is being further developed and maintained! Is it possible to create a function where AMK automatically receives the GPS coordinates when calling?,2,28-10-2012,1
6cc5bdf3-459c-415f-a1a7-dce843c8f197,En Google-bruker,I see that this app has become free,2,28-10-2012,1
8e36de9f-394b-4297-96ce-31f7e5c7987e,En Google-bruker,Help 113 GPS,2,08-10-2012,1
26aa57dd-5165-4718-a16b-bbb1e43fa839,En Google-bruker,But the app should turn on the GPS by itself. At least it doesn't happen on my SGS2. Should also have been able to send an SMS with position.,3,03-10-2012,1
53259766-1698-4ec0-87ec-91a459322686,En Google-bruker,Superb,3,02-10-2012,1
bd7d383f-9ba4-4258-8b46-22983e066452,En Google-bruker,This app is very useful to have,5,30-09-2012,1
81f61923-5bc1-4048-85e4-3563e0c96ce7,En Google-bruker,Does exactly what it is supposed to,5,29-09-2012,1
79ce4a0a-dc65-4c6b-9902-0e10d190fb2e,En Google-bruker,"Nice way to support the air ambulance. You who talk about it being hurtful that ""someone"" is trying to make money in this way have not understood anything.",5,16-09-2012,1
aad8318e-6977-4b2c-bcdf-1ab4a7f96477,En Google-bruker,"In addition, it is very hurtful to see that someone is trying to make money out of something like that",5,07-09-2012,1
7e9253f4-e00c-4cad-8b03-4ca41ede7915,En Google-bruker,"Not a good way to update the GPS in the way you had been stressed. And you can't send direct coordinates, you have to say it yourself. If you could have a video call, it would be stupid :)",5,22-07-2012,1
d7003fdb-52e5-4f60-bdc2-deea1ab67a08,En Google-bruker,"The idea is very good! But it never manages to find my location! It finds the right city, but the wrong street address!",5,26-06-2012,1
b06ccdbf-7d95-484f-8773-4a274104b330,En Google-bruker,Simple and straightforward,5,08-06-2012,1
2fd54f4b-ae96-414d-8743-22986e76b4f8,En Google-bruker,"Good that someone has come up with this. Then all that remains is to get enough people to install it. Have tested it (but without calling of course), and it looks good. No addition to address, so you get longitude and latitude.",3,08-06-2012,1
2ecc54a8-b5d2-4954-abac-805d1e584d6e,En Google-bruker,"Fortunately, I haven't used this yet, and I can't test the app just to test. A 5 for a good idea.",5,06-06-2012,1
1621041e-84dd-4fb8-aea2-afecf8a81eb3,En Google-bruker,"Bought for IPhone and Android, works both ways.",5,16-04-2012,1
58b857fb-3f9e-4b3d-8537-e000b6c89d49,En Google-bruker,,5,24-03-2012,1
df43d3f0-0161-465b-9bb3-aa52a9ebc675,En Google-bruker,,5,17-02-2012,1
4d9d811a-60c1-4500-98d9-1dfe294604b5,En Google-bruker,,1,05-02-2012,1
423ac411-e27b-4aa1-98ea-c77cfd748fca,En Google-bruker,,3,17-01-2012,1
16e538ba-52fe-426a-84fe-91ff94ea9720,En Google-bruker,,4,06-01-2012,1
e948039b-afe0-48dc-93bc-cd7b65267589,En Google-bruker,,5,29-12-2011,1
eb99140e-0d2c-44b5-afab-70f2c76fd526,En Google-bruker,,5,15-12-2011,1
8ffa91d7-1993-4c7f-a387-d1b3214c7939,En Google-bruker,,5,17-08-2011,1
44c58ece-f8a0-4b22-991e-1f6e80fd9c1d,En Google-bruker,,5,01-06-2011,1
