,User Name,Review,Rating,Date of Review,Sentiment
328,ninja77777,Brilliant app! SMS/messaging function would have made it even better!,3,26-08-2019,1
329,Colero11,Can't manage to register an Åland mobile number. Unnecessary limitation of the number of digits in the number.,3,26-08-2019,-1
330,Per Nyström,"If you have forgotten that the app is called ""SOS Alarm"" and search for ""112"" in your iPhone, you will not find the app.",5,26-08-2019,-1
331,Tourist in Sardinia,Good App but it is not accessible for the deaf.,4,26-08-2019,1
332,Kryptering,"Does not work ""network error"" , problem with the server"" doesn't feel really reliable... Sweden's preparedness in a nutshell 😉",5,26-08-2019,-1
333,Brittalolo,Everyone should have this in their mobile,3,26-08-2019,0
334,Markus-h12345,"Why can't you track me if I call regularly and always share my position? If I crash badly and lie in a ditch, I want Siri to call 112, enter the trick with FaceID and open apps. If my number is registered (which it is) and the app always shares location data (which it does) you should be able to easily see where I am.

Stolpskott!",1,26-08-2019,1
335,Rasmusmatte,"I feel good that the app is there in case I get abused or something else, I can call SOS immediately❤️",5,26-08-2019,-1
336,strindevall,Good app,1,26-08-2019,1
337,personen son gillar colorfy,"However, missing a lock or similar on the app so that my little kids don't accidentally call 112 unnecessarily so they sit and play with the phone. Easily happened as ""Call 112"" is a large and easily accessible button, which of course I understand is important given the purpose of the app. But that was the first thing I thought of when I started it😊",5,26-08-2019,1
338,volvotdi,A function where it is possible to call 11414 via the app would have been a great upgrade. Then it will be easier to give the police a good position in cases where you don't want to stop 112,5,26-08-2019,1
339,Rokkahs,Insane that this didn't come earlier. But better late than never!,5,26-08-2019,1
340,Herr Turesson,"Good app to have... however, I feel that after installing the app, the mobile phone (iPhone) draws significantly more power! Haven't installed any other app and my usage in the last few days hasn't been any different, but I've had to load it more frequently!",4,25-08-2019,1
341,Cinem8ic,.,5,26-08-2019,0
342,Painjo,,4,23-08-2019,0
343,mcall,,4,24-12-2022,0
