,User Name,Review,Rating,Date of Review,Sentiment
0,Flane68,It seems really good but I'm missing ONE thing that I saw right away and that's a widget for it for quick access on lock screen.,4,26-08-2019,-1
1,Golihat,"The app would have been great if it wasn't so limited.
This is just one of the few things that must be implemented immediately:

To be able to search in areas and get real-time information.

Being able to share your position through registration when you call 112 (without calling via the app) should be a matter of course, but does not currently exist. Would make it easier for both users and staff at SOS.

Adding a Message function, for those who need to contact 112 in silence or are unable to speak.

Multilingual support and selectable in settings.

Be able to delete messages you have already read and do not want to see.

Be able to see the history of events in the area you searched for/are in, 24 hours back in time.

Make sure the servers are working 100% as the app often loses communication with the information flow.",3,26-08-2019,1
2,stinade,"The top with an app that shows location. But I, as a hearing impaired person who has been granted the option to text 112 instead of calling, would like to be able to do that via the app as well.",4,26-08-2019,1
3,millemiglia,"Works well on the iPhone, but for the full pot I would like to see an app for the Apple Watch where you can alert 112 with position entry with a push of a button...",4,20-09-2021,1
4,CU 'n' HELL,"It should be standard that this application would already be pre-installed in ALL mobile phones sold in Sweden today!!!
Regardless of operator, mobile brand, model or operating system version!!

//Peppe ツ",5,26-08-2019,0
5,Studenten1990,"Great app! I an unregistered number, one suggestion is the possibility that you can voluntarily enter the name and/or social security number sent with so you know who it is that is calling ",5,02-10-2019,1
6,funko philip, Live in Stockholm ( Usually happens a lot ) but have never received anything regardless of whether you have on always show position,1,02-10-2022,0
7,Tigerhonan,"What's the point of this app when no current events come up? For example, in the event of a fire, nothing will come out which could be good for the public to know ",1,12-09-2022,-1
8,Johan Partanen," Doesn't work, crashes after 1 second. Please fix!",1,01-01-2022,1
9,MacMarsl,"After the last automatic update, I can't use the app anymore on my Iphone 6. Without explanation what's wrong, I can only guess that users of older smartphones are not welcome. Shame, because I've been really happy with the app otherwise and have recommended others to get it.
Tip: You can keep the older version of the app for those who don't want or can buy the latest over the phone.",1,25-12-2021,1
10,fijcfrhj,"Always when I get a ""ping"" about a new event and a notice on the screen, I go into the app but there it says the top of the green field ""no current events"". Clicks on that text and comes to current events where there is indeed an event.
Going back to the start page and now it says in red ""(a) current event"".
Have submitted an error report via the app about this but received the reply that completed events are not visible on the home page.
But these are _current_ events that are not visible on the start page.
In the beginning I missed a lot of info because it incorrectly stated that there were no current events.",3,25-01-2023,-1
11,timotej81,"Haven't received notices for almost two months, compared to previously several notices a week. Live in a big city. Doesn't it seem reasonable that nothing should have happened for two months...??",2,04-02-2021,0
12,Vilsen jurist,"The only thing that works in the app is to call 112, which feels quite far-fetched to enter via the app instead of dialing 112?

There are NEVER any current events, although things are happening all the time.

Right now, there is an ongoing fire that is included in the other app (for workers within SOS), but this one says ""no current events"" as usual.

So what exactly should you have the app for?",1,17-01-2021,-1
13,JWL74,"Good app, now it should only be made available for the Apple Watch so you can alarm from the watch if you have the LTE model. Would be great.",5,07-02-2020,1
14,carinautter,"Doesn't work no matter what I do in the settings! Never receive any notifications despite, for example, a fire 100 m from where I live. Also, there are NEVER any ""completed events"". That such an important App doesn't work is beyond all criticism, shame on you!",1,13-10-2022,-1
15,Encryptimous,"My app tracked me 71 times in the background in 3 days. Why?
There is no reason why the 112 app should know where I am when it is not in use. The app recommends that it should be able to know location information at all times.

It's nothing but control, knowing where people are, big brother is watching you.

I deleted the app!",1,08-10-2022,-1
16,Missnöjd stamkund!,"I collided with a Moose and of course took the phone and called SOS with this app, as I was out in the middle of the forest I thought it would be good if SOS got my coordinates. But I could easily forget that. SOS didn't get any coordinates and it took at least 30 minutes before they could even figure out where I was, then it took another 40 minutes before the first rescue vehicle arrived. Luckily I was only slightly injured. I don't even dare to think what would have happened if I had had more serious injuries. Scary bad app and scary how they promise that SOS will get my coordinates when they don't.",1,09-10-2020,-1
17,Substans av dignitet,"I have enabled location services for the device in ""settings""-""privacy and security"", but the app does not appear in the list found at ""settings""-""privacy and security""-""location services"" where you can give additional instructions about when the location should be given.

For example, the app ""always open"" is in that list. For that app, I can choose to define ""never"", ""ask next time I share"", ""when using the app"" or ""always"". SOS alarms are not in the same list.

I have restarted the device but that doesn't fix the problem.

I get an error message in the SOS alarm app that ""the app only works correctly if it has access to location"". At that alert, I can press ""change"" and then I am linked to the app's settings, which can be found under ""settings""-""SOS alarm"", but even there there are no setting options related to location. There are only ""Siri and search"" ""notifications"" ""app activities in the background"" and ""mobile data""

I have checked if other apps location services work and they do. I have checked this by, among other things, starting the Badoo app with location services activated and then I get an alert where I am asked if I want to share approximate location or exact location and this in connection with a map that also shows my exact location.

at ""settings""-""privacy and security""-""location services""-""share my location info"" I get a sys modal alert stating ""Share my location info not available. Unable to connect to the server. Try again later”. I have then scrolled down to ""system services"" in the upper menu level ""location services"" and there under ""system services"" I see that ""share my location info"" is activated. The other enabled location services for system services are ""device management"" ""find my IPhone"" ""mobile network search"" ""network and wireless"" ""emergency call and SOS"". Other 12 system services location services are not activated. For example, do not want location-based notices and suggestions, seller identification, iPhone analysis and other privacy violations. However, these deactivated ones do not receive any result regarding finding my location when using maps such as Eniro, SL, Maps.Me, Kartor and Sverigetaxi.

I have unlimited data. I have internet connection.

The phone is set in Lockdown mode. Uses that setting because, among other things, it disables JIT compilation for Javascript. Bugs in the JIT are exploited by 45% of all Malware that attacks devices via a browser. I've only experienced trouble with one app before due to lock down mode and that's the Line app. Then the text message that you need to verify the number is not sent. However, I received that text message when registering in SOS Alarm. Even Instagram's automatic login by recognizing the device after reinstalling the app doesn't work, so you have to enter the password the first time you use that app. Otherwise, I don't experience any problems except that some fonts in browsers that refer to icons become squares, but this only indicates that the web developer is deplorable in that they need frameworks and Google fonts etc. so that they don't have a good grasp of what they really are has under the hood.

Under ""settings"" - ""privacy and security"" analysis and improvements"" all settings are disabled.

I am in Sweden.

ISP Tele2.

I am not connected to an Access Point ie router + switch.

I'm not connected to a VPN. VPN is under settings ""not connected"" and the program that refers to VPN is completely turned off and not started after reboot.

I haven't tested whether the SOS alarm works if you deactivate Lockdown mode because then I get Pegasus right away. A device that is in lockdown mode is probably extra interesting, so now I don't dare turn it off, even though I'm an uninteresting person.

I give one star because there is no information about the app not working in ""Lockdown mode""

A big thistle for Sweden's SOS service, which has not implemented GPS detection for regular phone calls like other countries, so you need an app instead. It is sad that Sweden has fallen so far behind in almost every technological aspect and also in areas that concern our welfare.",1,01-02-2023,-1
18,Valter Isander,"Regular notifications that something has happened, but zero is notified in the app. Type The wolf is coming. Bad.",2,08-12-2022,-1
19,Minihopp61,Replace phone (broken phone) app is there but I can't go any further - can't accept the terms - which means the app can't be used. On the previous phone it worked great. Have also deleted the app & downloaded it again - no difference,1,18-01-2023,0
20,Not a police,"Given that the app has been around for a while, there should be more information in the app, such as info about ACU test, CPR.
And that it would be possible to add the app as a widget for faster access if you now want it to be used to make it easier for you when you call",4,17-11-2022,1
21,Ovedyr,"Can someone explain why the app needs to see my location at all times? When I log in, I choose my address and then this means that I want to be notified when something happens in my area.",1,06-12-2022,1
22,Jonas69,The app is nice and simple. But it seems that they raise a bit of an alarm when they feel like it. ?,3,20-11-2022,1
23,iMan Sweden,The app does what it should but support for CarPlay would be useful!,4,24-09-2022,1
24,Mattemamnen,When is support for IOS16 coming? Location services a no longer work.,3,13-11-2022,1
25,Whisky 1961,"I get notifications, but very few e.g. then when it was full smoke around my house and the neighbor's house was in flames!?!? Then surely something should happen with the app!! Have set everything correctly with full authorization 🤔🔥👩‍🚒🚒 !?!?",4,20-06-2022,-1
26,PatrikPatrik,Basically only get notifications that there has been a fire outside 5 km away.,2,21-09-2022,-1
27,DetFunkarInteMedSmeknamnFan,"Plings to a single time sometimes, checks immediately but the app says that it is not are there any current events in my vicinity or when checking a larger area. Uninstalling now",1,20-08-2022,0
28,Bhstikjftpssjbcjud,"Had to turn off the notifications because of the traffic disturbances which (if you live in central Gothenburg) came far too often, don't want a push if someone crashes on Hisingen, I can read that in the newspaper. On the other hand, I want a push if there is a fire in the house next door. Divide the notifications and put personally selectable distances on each notification category.",2,12-08-2022,-1
29,Niklas6975,"Have been using this app for a long time and not much works! SOS sends SMS but there is no notice in the App. If you are at a traffic accident and it is stationary, there are no notifications. I hope that at some point a relatively important app will be sorted out..",1,06-08-2022,-1
30,Fisabet,"Today there was a VMA but my app didn't say anything, I heard it on the radio. It never says anything about everything that happens inside the node, even though it says in my settings that the app should work correctly with all location information etc. correctly set. . Have double checked all settings several times. Received notifications almost daily until a few months ago. The app is great when everything works and notifications are visible.",1,04-08-2022,1
31,sandratn,"No matter what I do, even the location info setting is not there to confirm, so without it the app is useless.
What is missing in the app is a chat with 112 for silence/ denigrating people.
Even if you can change the language, it shouldn't be too hard to add English, Spanish and all the major languages.",3,18-07-2022,-1
32,the weird boi,SENDING PUSHNOTES WITH A LOT OF CAPS. IT CAN BE PERCEIVED A BIT SCREAMING SOMETIMES.,1,23-06-2022,-1
33,Gufo X,"Very few events enter the app, usually you get to see things via the media but no info at all here. Bad",3,16-03-2022,-1
34,freddieb77,"It is very bad. Every time it has come up on my MOM's mobile that it is on fire, but it does NOT on mine..!",1,17-06-2022,-1
35,Minipajen,"My iPhone SE does not recognize that the 112 app needs any location service, therefore cannot grant permission in settings either via the app.

Siri, notifications, app activity in the background, and mobile data are the only ones I can give permission to.
So will not progress at all",1,03-06-2022,-1
36,vad i helvette,"For 6 months I have received a notice.
Even when I know that a fire has broken out nearby, the app does not tell me any current events.
Thanks o hello and uninstalled.",1,31-05-2022,-1
37,Mjölby10,"Instead of the generally accepted format of degrees and minutes, degrees and decimals are used. Not being able to provide a location in an understandable way can mean that a rescue effort is significantly delayed which can have devastating consequences.",1,07-05-2022,-1
38,Musse_1,It takes a huge amount of battery if you allow exact location. If you do NOT allow exact location none of the features work.,1,04-04-2022,1
39,Bananlola,Thanks for the update for older devices. Now seems to work for iPhone 5 with latest iOS again 👏,2,21-03-2022,1
40,Axxxelina,"My iPhone 6 there I never get any audible alarm signal, why? All settings are OK. When self-testing, alarm signal sounds but never in sharp mode?",4,06-01-2022,-1
41,mårtis,"Get a message to make sure you have the right settings. Since then the app cannot be opened. Maybe related to the latest update. iPhone 6, software 12.5.5.
Solved on the next update a few days later 😊",2,04-03-2022,1
42,okhyrf,"After update I can't open the app. Should work on iPhone with version 10.0 or later. I have IPhone 6 with version 12.5.5. Have deleted the app and re-uploaded, but still not working.

Thanks for the feedback, have seen that it is now working again.",5,20-01-2022,-1
43,SosFel,Not alarming.,5,20-01-2022,1
44,modärn mono,The GOS position has stopped working. Does not retrieve the GPS position despite correct setting.,1,16-01-2022,-1
45,Användare 6423,When will it work with iPhone 6?,3,29-12-2021,0
46,bngt.l,Crashes only after new update iOS 10.3.4,1,04-01-2022,0
47,Hif_0457,112 sppen no longer works after the update you did 😭 tried to download it again but it shuts down immediately,1,31-12-2021,-1
48,ann.lindberg, Can't open the app after the last update!,1,31-12-2021,0
49,Lars-M-1,After the last update the app doesn't work in my iPhone 6. The app opens for 1 second and then closes.,1,30-12-2021,0
50,Seg-m,Has iPad Air 12.5.5 and the app is now unusable,1,29-12-2021,0
51,ur kasst,"Great idea of ​​an app ! Especially if something happens and you don't know where you are.
However, I would have liked the app to open when the phone was locked and for you to enter important information about yourself. Ex. Allergies/blood type etc.",1,29-12-2021,1
52,Lennie kakao,"Three accidents later, I'm wondering if this app works or is buggy. All the traffic accidents were in my vicinity and information about them was heard on the radio. The app……nothing.",5,24-12-2021,-1
53,Sundsvallsante,Has iOS 12.5.5 and the app stopped working on both.,1,28-12-2021,-1
54,Suupergoood,Worked before but now I can't open it. Have uninstalled and downloaded again without it working,1,26-12-2021,0
55,pellemöllare,The app cannot be opened in iPhone 5 after the latest update.,1,22-12-2021,0
56,Lev-i-nuet,Should work for all of Sweden but not on iPhone 6 latest iOS 12.5.5,1,20-12-2021,0
57,gripå,Can't open after latest update. Needs to be fixed.,1,20-12-2021,0
58,Sven_08,After last update can't start app in apple6. What's wrong?,1,18-12-2021,-1
59,kundj-l,Please add flashing lights to the Alarm signal. Can help with hearing loss.,1,17-12-2021,1
60,asdg654,The app doesn't open on mobile?,4,16-12-2021,0
61,Enra!,Think you should have a tab with simple rescue instructions. Type heart/lung massage and forward side position.,1,17-12-2021,1
62,rakesson,Good but wish it was also available as carplay,4,23-11-2021,1
63,Plumberjep,"Incredibly limited radius. At the nearest kilometre, you might get an alert about a traffic accident or the like. But now it may be that it is good to find out, for example, traffic accidents well further away so that you can avoid driving there. It is not particularly useful when it pings when you pass the accident or does not ping at all. Even though the accident is not very recent. Perhaps a function where I can choose myself how large an area I want to receive information about? Otherwise the app is a good idea with coordinates and such.",4,08-11-2021,-1
64,Baldboy77,Very good and important app. But what's the point of putting in which area you want information about if you still get it from all over Sweden?,3,10-11-2021,1
65,nummelina,Have had the app for quite a while now but don't get any notifications whatsoever. Just recently there was a car accident in my area that I was notified about via Facebook where someone else got the information via the 112 app. The settings are as they should be and have reinstalled the app several times without getting any better.,4,04-08-2021,-1
66,smeknamn78,"I previously refused to activate location and have to reinstall the app to get it back in the settings menu.

Don't forget to send the location request before we are sent to settings",1,17-09-2021,-1
67,Jniden,"I don't get information from when the area of ​​traffic accidents or other events but my wife does. However, I get a lot from another part of the municipality. I have all notifications turned on and exact location.",3,16-09-2021,-1
68,Vaionixx,"To use the app, you must agree to terms that you must log in to a website to see and read what applies from time to time for use. So just when you use the app. Incredible!!! Here is the condition: You should regularly take note of the instructions and announcements provided on www.sosalarm.se and the change then applies to you as a user from the moment the announcement is entered on the website.

Comment on the comment:
What you express in the comment below is, as far as I can see, not in the terms and conditions.",2,12-09-2021,1
69,Tappad kund,"Since I downloaded the app, I have discovered how many ""outdoor fires"" occur within a radius of over 2 km from my home in central Gothenburg. Thanks for that info, but I don't need 1-5 daily notices that there is a bush on fire on the other side of the river. Please let me choose the radius I want notifications within!",1,08-09-2021,1
70,GreatGuyAndy,Didn't show my location,2,06-09-2021,0
71,siggggggge,SOS with emergency call and few coordinates is good. But sos doesn't seem to get coordinates. The app cannot report accidents or obstacles. Can't send message just tinga,1,28-08-2021,-1
72,Jonaswash,Had the app for a while and don't get current events at all. Without that page on the app is just blank :/,2,12-08-2021,-1
73,erikssonemmma,"The now mentioned 08-112, which is used by SOS-Alarm, should be entered in ""Important numbers"", where it should also be stated what it is for.",3,10-08-2021,1
74,dironi,An ICE number entered in the 112 app,4,29-07-2021,1
75,Lucasedorsson,"It being only available is Swedish is not good enough, we want english and polish.",4,29-06-2021,-1
76,Spongy Sponge Spoon,But it would be much better if you found out when the situation was over,3,23-07-2021,1
77,vonroser,"According to the app, nothing has happened where I live but it has and most of it has happened here. Deleted app as it doesn't give me anything at all 👎🏼👎🏼👎🏼👎🏼👎🏼",5,19-07-2021,0
78,Belloepo,"Gets no alerts at all - all notifications are on, can stand next to an exclamation - still removed no notifications .
I get no notifications at all - stood next to a fire the other day - others in the village got notifications but not me...",1,07-07-2021,-1
79,Krokan0112,"The app is great and clear. However, it fails to warn of nearby dangers. The building next to my house was on fire but didn't get a notification on the app. Would like to see this in the future in case you don't know there is a fire nearby.",1,18-05-2021,-1
80,(Piloten..),The app should open automatically even if you call 112 outside the app. This is how Norway's sos app 113 works.,4,19-12-2020,0
81,ScamSwe,Grtr,3,12-05-2021,0
82,penniwase,"Doesn't receive an alarm even though the app sees that I am close to events that my husband receives SMS alerts about, e.g. fires with toxic smoke. Useless app.",5,14-04-2021,-1
83,Degili01,I never get any notifications unfortunately.,1,11-04-2021,-1
84,Sb-07-,Not getting any notifications at all since December. Just ended up in a traffic accident then go in and look in the app (which is otherwise set to automatic update) but then the accident is not registered where hr happened several times now,1,10-04-2021,-1
85,varbättreförr,"Called 112 from the app twice on the same occasion in an emergency mode where I didn't know where I was but thought they would see through the app. You are forwarded to 112, which took even longer to arrive and then no one could see my location despite the correct settings. Not recommended.",1,02-04-2021,-1
86,xosna,Doesn't come up despite car theft and only nearby.,1,26-03-2021,0
87,Niclas-1967,"I don't understand this app, have to delete it!",1,13-03-2021,0
88,ida85an,Want widget so I can have it on lock screen,1,05-03-2021,1
89,Asdfcvb,Can't activate location services.,3,04-02-2021,0
90,EmmaVeronica,"Unfortunately works not location services despite several attempts and that location services are turned on in general settings. The feature doesn't even show up in the app's settings. As a result, the app is not usable as intended.",1,04-02-2021,-1
91,seni64,"Says that something has happened, but then can't get any information about what!!",2,17-01-2021,0
92,Crublf,"Version 1.0.19
Have wanted this since several versions but still in Version 1.0.19 so the option is MISSING, lowers the rating!
I miss all alarms/notifications because the app is too DISCREET!
I want to be able to choose an audio signal myself so that I notice when the app warns/alarms, and preferably different for warning versus info.",1,25-12-2020,-1
93,69 :-p,Good app if it would send out a message when current accidents happen..the newspapers are even faster to inform,1,25-12-2020,1
94,olssonp,Will this app be available in English in the future?,2,20-12-2020,0
95,Username6383,Very good app - a must on the phone. It would be great if you could see the nearest defibrillator as well.,4,12-12-2020,1
96,SnurreSpratt,"Found that the phone's battery was suddenly draining much faster than usual and found it was this app. It is NOT due to latest iOS, as my phone doesn't even support this. Of course, it is not possible to maintain the app with this potentially dangerous flaw. Uninstalled!",5,05-12-2020,-1
97,HQ55,No nearby events showing despite reinstall and “perfect settings”!,2,29-10-2020,-1
98,Appmaster10,"App doesn't work at all despite installing 3 times. Can't decide own phone number, can't press ok, the button is behind the keyboard. Another time I did not receive an SMS code. O despite all the settings was updated on October 9. Useless.",1,28-11-2020,-1
99,Knäppisen13,"Good app and good thinking with it, however, takes 20% of my battery usage daily which I can't ""afford"".",1,12-11-2020,1
100,Jaburek,Good app that unfortunately uses far too much battery in the background.,3,16-10-2020,1
101,Jånni,"The primary function of the app must be to feel sure of being found in the event of an accident in e.g. the mushroom forest, or..
How does it work when the app has drained the battery? - Not so good!!
Correct on disturbed!!!",2,28-10-2020,-1
102,Åke Malmborg,"WARNING! The app is a battery thief, go in and look under Battery settings! As long as it's under such high load, it's not on my phone anyway!",1,26-10-2020,-1
103,Maths,Catastrophe app drains the battery from the phone in half a day!,1,23-10-2020,-1
104,pluttens Ägare,"Draged AS much battery from the phone. And it's a shame that you can't send a message to SOS!
Do they think something happens and you can't call!!",1,21-10-2020,-1
