,User Name,Review,Rating,Date of Review,Sentiment
105,Kakan123123,"Good and important app, but as other users have written, it eats battery! During a 24-hour period, it accounts for 35% of the battery usage! And compare this to the fact that I have music apps running for at least 8 hours per day which accounts for about 20% of the battery usage.",2,19-10-2020,1
106,Lima1975,"Latest version (1.0.15) seems to drain the battery very quickly.

Suddenly my phone started draining very quickly. Then checked the phone's power consumption and discovered that the app accounted for a very high percentage. Haven't experienced that problem with the previous versions, despite always having location information turned on.

Otherwise the app is ok.",2,16-10-2020,1
107,DW_SE,"Hi.
I can't launch the app, it crashes instantly. Should you update the OS or the app?",2,16-10-2020,0
108,Lassepelle,"Since the last update, the app eats a lot of battery! Before I was satisfied.",3,13-10-2020,1
109,fd nöjd,"Good idea but the app is completely unusable as it uses 100% CPU constantly.

You wonder how they thought you could call 112 with a dead phone.",1,14-10-2020,-1
110,Jesus Josefsson,"Draining the battery!

Great app but a super CON is that it drains the battery on the phone as it needs to be on location service to fill the function with the app.",1,14-10-2020,1
111,Bästa appen!!!,Started draining a lot of battery!,2,13-10-2020,0
112,björnbjörbeb,"Seriously, I have several apps running in the background without use them. This app is taking up 23% of my phone's battery even though I've been inside the app a handful of times since it came out.",2,10-10-2020,-1
113,Boogieman501,"Sucks up all the battery even if you have the latest os and everything is up to date, uninstalled on all devices",1,12-10-2020,-1
114,silmarillon," What is described as version history is amateurish, sharpening. Now I want to see in the history that the battery problem is solved.",1,11-10-2020,-1
115,BoAorm51,"The phone no longer works and the battery drains in no time.
When I removed the app my handset works again.
Otherwise it was a good app",1,10-10-2020,-1
116,Per i trelleborg,"The headline says it all!
Must be better to be able to call for help the normal way than running out of battery because of the 112 app",2,09-10-2020,1
117,Havetouseanickname,"Running out of battery. Had to uninstall. I don't have iOS14 installed, so it has nothing to do with it, as the app developer claims.",1,09-10-2020,0
118,Kröllll,This app did exactly what absolutely should not be done in a potential emergency. It drove the battery to the bottom! The phone was as dead as anyone needing emergency help had been. Unacceptable bug! Is there the slightest chance that you may need to contact 112 trust the good old keypad and uninstall this!,1,09-10-2020,-1
119,ertwrwrtywrytryerty,"Like the app but something seems to be wrong with the latest version (and possibly the version before that). In the last week or two my phone has been running out of battery very quickly. Today I checked which apps drain the most and 112 had eaten 33% of my battery in eight hours, just from running in background mode (with access to location data).",1,08-10-2020,-1
120,Datacarl,"After the last update, the app eats battery. Something went wrong with the update. It has never been like this before. Because it consumes so much battery, I had to delete the app. You guys have posted the same standard response to all the comments, but since I haven't updated to iOS 14, and the app still eats batteries, the problem should be in the app and not in iOS?",4,07-10-2020,-1
121,Stepmonto,"Good app but it uses a lot of power. According to the battery status in the phone, the app uses about 35% of the battery during 24 hours.",1,08-10-2020,1
122,Tobbe G,"As others have already written: the app has started to draw a lot of battery, it was not a problem before. Deleting the app for the time being.",4,03-10-2020,1
123,Knto&Kno,"Almost never get a crash notification anymore. I did get one today but my sister didn't get one, the accident was pretty much in the middle of our homes",1,07-10-2020,1
124,Olinen75,This app is draining the battery on my iPhone. How smart is it for an app that should work in emergency situations?,1,06-10-2020,0
125,1234567890-/*+=,Drains a lot of battery. 30% of today's consumption is the sos app alone. Fix!!,1,06-10-2020,-1
126,Hepsnastian,"Pulls out the battery. Better to have power left in the battery in case something happens, than to have an app on a dead mobile.",3,06-10-2020,-1
127,levelrebel,Finally figured out why I woke up several days with a nearly dead phone. Prioritizes being able to call so now location services are turned off and the next step will probably be to uninstall the app if no update to the app comes soon that fixes this problem.,2,06-10-2020,-1
128,sven3567,In the latest versions of the app it has started to drain a lot of battery because location information is always running in the background. That has not been the case before. I've set it to only use positioning when the app is running but then it loses almost all of its functionality. Please fix this.,1,05-10-2020,0
129,MagrothJ,The app takes a lot of battery time when it is constantly updating.,2,03-10-2020,0
130,Lintrup99,The app has started using a lot of battery in the background in the last week (up to 15%). What has happened? Before it was used about 1%.,2,03-10-2020,0
131,muff711,"Like many others, I now have problems with the app using too much battery. I have therefore uninstalled for now.",2,03-10-2020,-1
132,ZkilfinG,"All of a sudden the app has started drawing a lot of power. Have location services ""forever"" and never had a problem before. But now something has changed. Have two phones and both have the same problem. SOS Ab, investigate.",2,03-10-2020,-1
133,ClaesT,"Very good app, the only problem is that it is on constantly as it should always have one's location service. Which results in the battery being discharged to 50% overnight.",2,02-10-2020,1
134,linkann,"Almost never get any info about events.
Latest is in March..",2,02-10-2020,0
135,Greatersereghhhh,"Having the 112 app installed is a security risk.
On several occasions recently I have been surprised by the phone shutting down due to low battery.
Yesterday I uninstalled 112, during the whole day today the battery capacity has dropped to 96%.
So it wasn't wrong with my battery.
Damn lousy of an app that is meant to be helpful in an emergency situation.",1,02-10-2020,-1
136,UrbanSigurdErikLudvigTore,For some time now the app has been eating battery on iOS so unfortunately it expired now 😟,1,02-10-2020,-1
137,fkekfkfkdk,"Great app it has been, until now!
Latest version perfection butchers battery life. In the last 24 hours since this version came out, I have to charge very often and SOS eats between 43-45% of the battery capacity in the background! (So ​​with the app turned off)
You have made a hotfix you say. Hurry up and do another one focusing on something else please.",1,02-10-2020,1
138,J a g v e t,"The concept is good and the app as such works, but even if you never open the app it drains a lot of battery. The Battery app reports that this app consumes between 30-40 percent of my daily total consumption. Totally unacceptable.",1,02-10-2020,-1
139,Tjita1,"Guzzling hysterical amounts of battery lately. Otherwise, a good app if you correct this immediately, because right now I don't dare to have it running in the background.",1,01-10-2020,1
140,MmmmStranne,Very good app!,4,25-09-2020,1
141,Sebbo176,"After the last update, the app has started to eat battery. Have drained the battery completely 2 days in a row",5,29-09-2020,-1
142,Tobiaz75,"If you alarm with the iPhone's built-in function, in addition to the position, the medical ID is also sent. So why use this app? And got annoyed that the battery was draining fast after the last update.",1,26-09-2020,-1
143,losJugglos,"After the last update the app is eating battery, so thank you bye",2,26-09-2020,1
144,W0LF4R1,After the last update it has become a battery eater if background refresh is allowed.,1,26-09-2020,0
145,Rolf Kemupp,"The last few days my battery has been draining at record speed, Empty. in airplane mode during the night. Therefore, I have had to turn off location services when the app is not in use. (What good are location services when the phone is dead anyway?) It wasn't like this before the last update. Redo, do right!",3,22-09-2020,-1
146,Anaurora78,"This morning I had 3% left in the battery, which was fully charged yesterday. A check of the statistics showed that this app was constantly running in the background during the night, to almost 0%.",1,25-09-2020,-1
147,Lelle Kidd,"Recently I have not been able to cope with a normal day on a full charge, checked the battery health which was good (97%) since the list of heavy users and this app is by a large margin the biggest consumer!!! 33% due to background space and the runner-up uses 16%. Crazy!! Fix this please!",1,24-09-2020,1
148,DrLove76,"Good app, but according to my iPhone's (SE 2) battery usage page, it is by far the most draining app in the background.",2,23-09-2020,1
149,xxAndyCxx,"The app has started draining my battery.
Don't know if it's the app's fault or Apple's.
Or something else. Good app, but have you guys stopped giving out information? Has been quiet since spring despite full of blue lights in the area.",3,21-09-2020,1
150,Auditor7,"I do not intend to allow GPS positioning or give out my phone number, that is my private privacy policy. Therefore missing the possibility to manually set which areas I want notifications for. This would also have the advantage of being able to receive notifications for several areas at the same time, such as for example me in Stockholm and my demented mother in Norrland. The crisis information app has this possibility.",2,21-09-2020,-1
151,KrashLander1337,"Since a few months ago, I no longer receive any notifications about events in the immediate area. Feels like the app has lost its function.",3,16-08-2020,-1
152,TheRealZwaa,"The one next to me got information about a crash but mine doesn't want to show anything. Have the same settings and the program is updated.

You should be able to choose the radius yourself",1,21-09-2020,-1
153,LondonRiver,"Never get any information, read the news instead",1,19-09-2020,0
154,Iphone Crysie,"Unable to announce major operations, accidents and local VMA when the app is running in the background.",1,10-09-2020,-1
155,Ask_72,In the case of several fires in the immediate area that have been confirmed via contact with SOS Alarm so no information about the incident has been communicated via the app.,1,04-09-2020,-1
156,Nomsmoms,"Be the first on the scene at a traffic accident. Called 112 via the app and didn't have to give the location, just confirmed to them. Takes a lot of the stress out of explaining where you are.",2,01-09-2020,-1
157,Ulf08,"The position is not to be trusted. It shows neighbors houses and doesn't quite find the right position. If the app is to fulfill its purpose, it must be updated and dot the right place.",1,29-08-2020,1
158,Fredrik.P.A,Works well. But it would be great if you included e.g. Fire ban in my area.,5,15-08-2020,-1
159,axenryd,"Totally worthless, had very much higher expectations for the app, in my eyes it could be someone learning to program who did this, but guess money comes into play as usual, cheapest bid...

Meh, won't email any support and tell them everything, have other things to do...",1,06-08-2020,-1
160,Muraren66,Doesn't work in Småland maybe is too much like Stockholm completely useless,4,21-06-2020,-1
161,John Dooe,"Good. But the app often loses its function regarding traffic accidents, because the radius is too small, so you often get the notification when you have already ended up in the queue at the scene of the accident. I would like you to be able to choose how large a radius you want to search for information about. Then you could plan your route in time, before you end up in the queue.",1,01-08-2020,-1
162,hjäip,"Despite the app being updated and notifications activated, I don't get any current events or notifications",1,01-08-2020,0
163,Sweetcicci,Totally useless as I never get events even if others do,3,26-07-2020,-1
164,ajdan01,"Would like be able to enter numbers for relatives.
At the same time as alerting the sos, text messages should also be forwarded to entered ""relative numbers""",1,18-07-2020,1
165,Nanoh8,"Informs quickly about important events, feels safe to have on the phone.",1,12-07-2020,1
166,..u7t2.!?(kr/,"Had the ""opportunity"" today to use the app to contact 112 when a person fell badly and hit himself so the blood spurted. I describe the area we are in. The operator then asks, ""Yes, but which city"". The reason why I called via the app was precisely that my position would be shown exactly instead of using the normal phone.

Now there was absolutely no danger to life this time and that I showed exactly where we were. But if you are out in traffic on a long journey, one's position can be much more diffuse to describe.

You should probably test this to a greater extent!
Have an iPhone 6a",3,12-07-2020,1
167,alex_swe,"As many others have pointed out, the option with a widget is desired. Mainly so that the children can easily call in an emergency.",5,01-07-2020,1
168,Stickan77,It doesn't seem to work with automatic updates. Found out I had an old version when I got a reminder to update. All other apps update automatically but not the 112 app.,4,18-06-2020,0
169,Simon Valley,... who programmed this app??? You don't send messages in notifications to talk about updating the app! The app should be updated automatically via the AppStore!! Morons! 🧐,4,06-06-2020,-1
170,Øyvind Rizla,"Recently, I have received notifications almost daily that seem to be about various tests of the system. One day several, but so far no real alarms. Starting to think about the usefulness of the app.",3,16-06-2020,1
171,kafka27,"Despite sirens to the right and left, there is no information about this in the app..?!",2,16-06-2020,-1
172,EilertPilarm,"I used the app in an emergency when I called 112 and then had it set to share location information, which it did not. That was the main reason why I downloaded the app and have been letting it see my location all the time for six months but still it didn't work.",2,11-06-2020,-1
173,siigurd,There was a shooting that had happened here and there was no warning about it in the app. Even though a lot of police and helicopters were involved.,1,07-06-2020,1
174,karinCFG,"The app is really awesome! We like to walk in the woods and hang out quite a bit at the shooting range, and the app helps to feel safe if something were to happen. Keep doing more, which can contribute to safety!",1,06-06-2020,1
175,1235383615,"The app description is in English, but the app is in Swedish, even if my iOS is set to English.",3,30-05-2020,0
176,gggoootlaaand,"Thought that you would benefit from this app when you are after the roads but it does not show accidents that are 15 km away so do not recommend this one.
Got 6 hours old info when I passed SOS Sundsvall, hope the fire brigade had managed to put out the fire in the container then 🤔",5,05-06-2020,-1
177,Design by Adrian.,"Warning notices sometimes come several days after, for example, an accident has happened. It doesn't feel as direct as you would expect from an app like this.",3,20-05-2020,-1
178,G Gurra,"My app is completely silent although things happen, some people get notifications while mine is completely silent, worked fine until 2 weeks ago, have reinstalled it but silent as the mouse 🤔",1,21-05-2020,1
179,qeertghiuikhgtr,Gets a message that things have happened but completely impossible to find in the app? Never been able to read any event. Totally worthless.,2,19-05-2020,-1
180,Pär den allsmäktige,"The app would be even better if you could quickly share your own health profile when calling. Information about which gate code you have, address, social security number, which medicines you take, allergies, etc. Most of it is in the medical record, but it would save time in an emergency situation. And to find the journal, personal data is needed.

I had to call in once with only a few percent of battery and was terrified that I wouldn't have time to convey enough information. Anything that saves time is worth its weight in gold!",3,07-05-2020,1
181,vieiy,"Eating battery, so now it's running out",1,18-05-2020,0
182,Ickgogogiuf,"When you post community information, I never get anything. At the moment it only buffers then it says that there was an error. Can never see the notifications you send out.",3,22-03-2020,-1
183,Pijotor,Nice app,1,07-04-2020,1
184,for fk sake,Community information 15/3 was notified but could not be read until the app was restarted.,3,15-03-2020,0
185,Gur-khan,"Why does it show up that something happened, but then nothing in the app?",5,19-03-2020,0
186,Heliokoptern,Thinks the idea on the app is perfect but it's often that I get a notification about a message and then can't open it up or get it in the app. Moderately annoying,2,15-03-2020,-1
187,gjfsfhklgffddghh,"If you pretend to have socially important information, you can't have a system that doesn't tell you what!!!! Gets message about important information but then it just says and loads with network error... have several clients and the same thing on all of them. Redo and do right, lots to improve!!! Terrible!",1,15-03-2020,-1
188,Smaddenr1,It doesn't feel good that info under Current events is not displayed when a push notification arrives. It just comes up with an error message or that there are no events. Maybe the app can't handle the load? It doesn't feel very stable after all...,2,15-03-2020,-1
189,Peppexxxxx9,"The app is a great idea and a great tool for authorities to, for example, get out important information.
The problem is, however, that as soon as some info is sent out and you open the app to read, you get an error message about a network error for a couple of minutes before you can read the message.
It is as if the server is not sized for the traffic that occurs.",1,15-03-2020,1
190,-Louise-,"Has Iphone Xs, IOS 13.3.1 (operator 3) and unfortunately ""network errors"" occur every day. Notifications come but when I go under current events, the events in the feed cannot be updated. Repeatedly.
Sad, I think the idea of ​​the 112app is brilliant, now I hope for a working version...",3,15-03-2020,1
191,Horrokotoj,Stupid to send out notifications for events/important information that still can't be loaded and viewed in the app. (It's never worked since the app was released),3,15-03-2020,-1
192,Morrmor,"Gets notification of events, but when I go to open them I get: “network error try again in a while” no matter where I am or what network I'm using.

Luckily I have the KRIS app, it works anyway.

Useless with an emergency app that can't show what the emergency is.",1,15-03-2020,-1
193,City-builder,"I get notifications that there is information to read. But then when you open the app, there is nothing at all",1,15-03-2020,0
194,Bearram,"When I get a notification about the current event and go into the app, it only says ""network error"" about 9 times out of 10. This is despite everything else on the phone working as usual.",2,15-03-2020,-1
195,pakke2k,Getting Notifier about community information but to see it I have to open the app. When I open the app it can't load community information. Fix stability and send more information in notification please.,3,15-03-2020,1
196,litentilda,"Current events do not load - ""Network error, reload.""",1,15-03-2020,-1
197,That nick is already taken,"Frequently receive notification of new info but since it is not possible to load news in the app, it feels pretty useless. Sometimes it is possible to get info after I close the app completely 3-4 times. Really bad unfortunately. Important feature not working.",3,15-03-2020,-1
198,swajp,"I'm very happy with the app overall, but I wish there was a dark mode for the app.",1,15-03-2020,1
199,Ambreswe,"But no messages can load, only see the header in the notification when I open the message it's blank.",1,15-03-2020,-1
200,AlexanderMangano,"Good worked with the app, but change Longitude and Latitude to a small map, alt. address instead. No one can tell if it shows right or wrong based on long/lat.

Edit: It is unacceptable that the app cannot reach the server. There just isn't. FIX IMMEDIATELY!",4,29-02-2020,-1
201,Baljan_only,You send out a notification about community information and then you don't have the server capacity to let people read it. What did you think?,2,15-03-2020,0
202,ÅttBoll,"Absolutely terrible app. Notifications come about new status updates in the current tab with events, but when you click, the app can never load the page.",2,15-03-2020,-1
203,johant,"When social information comes up and you want to check, you get a network error...",1,15-03-2020,-1
204,TomMalm,"When there is a notification about new Current information in the app, it comes nothing up at all in the Current tab, but the app needs to be restarted first (Iphone 8). Information about accidents nearby seems to work though.",1,15-03-2020,-1
205,Greek75,"If something happened a while ago that has been cleared up, the app will be weird...
Need some kind of ""history"" function",1,15-03-2020,-1
206,MariaNilsson2020,"The location information is several days behind, so info about the wrong area is sent out. Would have been good to have numbers for the poison information center among important numbers!",3,14-03-2020,-1
207,#D 62,"With an app like this, I personally don't want a general description like ""bugfixes & improvements"" for updates.
Rather take ""We are constantly working to improve your experience of the app..."" (not great either, but maybe you understand?).
Or write what you have fixed.
Anyway, I don't want to hear about bugs in an SOS app.",1,14-03-2020,1
208,isefjäll,Very good features in the app. It will be even better if you can make a video call to be able to quickly show what is happening or if you are in a vulnerable situation and cannot talk.,3,13-03-2020,1
209,Voidwatch_77,Both me and my wife have the app installed but it has happened several times that she has notices of fire nearby without my having received it. Have all notifications turned on both in the app and in the settings. Have now tried deleting and reinstalling the app. Let's see if that helps...,4,25-02-2020,1
210,secpet,"The app has been given all the permissions it needs, but despite that, it can't update 'current events'. No notifications, no events, just a button to call 112.

It feels like this type of app should work better…",4,22-02-2020,1
211,Marjons,A very good app but agree with another reviewer about the lack of a lock screen widget. Have another problem too. The app repeatedly asks for permission to see the location in the background. Even though I have given permission to always use my position. Something annoying.,4,02-02-2020,-1
212,Ebmhead,"Gets notifications, but when I check the app there is nothing current to read. Even though my wife can read on her phone about current notifications.",1,19-02-2020,0
213,gamersnart50,Extremely tough and chews for a long time before info about important event comes up. It needs speeding up!!,5,14-02-2020,1
214,Rattfält,"""Network error"" when it loads current events, but everything else on the phone works flawlessly 🙄",1,09-02-2020,1
215,Sigge Sthlm,It says there was a traffic accident 7 min ago but no current events since then...,3,09-02-2020,-1
216,Dlej...dlej...de...,"Fantastic app! The only thing that is missing is support for Siri shortcuts, e.g. if you say ""Hey Siri call SOS alarm"" or similar so that you call through the app so that the position can be included. Can be helpful if, for example, you get injured and can't access your phone",2,09-02-2020,1
217,Ljaralv,"Good app.. But eats up your battery as you have to allow location services always to get information/notifications.

So now you can only use it if you go in and check if you smell a fire or hear sirens in the distance.

And then you go in and get confirmation that they are burning and where they are burning.
You guys need to fix this.. I've had an iPhone for over 10 years and I don't know of any app in that time that completely drains the battery capacity like this..",1,09-02-2020,1
218,ericmaster1/,It's a great app👍🏻👍🏻👍🏻,4,26-01-2020,1
219,Mackan6666,"Piss bad app!
I give access to my location, give my number and enable notifications....But got ONE notification about a fire! Now there are zero events!
Bluff app that wants to map the location of people",3,27-01-2020,-1
220,bästa spelet🥳🥳,Have the app but would have liked faster information..today at 16:55 I received that there was a traffic accident in my neighborhood but when I press it it says that it happened at 13:45 ..,4,01-01-2020,-1
221,Mikey 247,"Great for me as a diabetic to have as extra security. It would have been perfect if you could write in your profile that you (for example) have diabetes type 1, so the emergency personnel would see it if it were the case that the speech disappears or that your blood sugar is so low that you cannot make yourself understood, because unfortunately it happens...",1,24-01-2020,1
222,Mrsnow10,"Hello!
Thanks for a really good app, the only thing I miss is that the app would work for the Apple Watch as you only have it with you in certain situations.",1,20-01-2020,1
