,User Name,Review,Rating,Date of Review,Sentiment
223,evsilfver,"Works very poorly. Who is responsible for the updates for this app. Is there any connection to 112?
Pops up a few things in the app despite a large amount of blue light events around me.
Does it feel a bit fake?",4,09-12-2019,-1
224,Fredrik&84,"According to the latest data, 1 in 4 people living in Sweden is foreign born and not everyone here speaks Swedish yet, so it would be nice to have the app support the English language as well.",5,26-12-2019,1
225,Ekenblom,"When one thing happened, I had to call and ask them immediately where I am, even though I called via the app",1,22-12-2019,0
226,vegidio,"And then the app became worse than before...
Under ""Current"" it is still not possible to update and that you cannot now change the settings for notifications at all.

Don't download this version of the app as SOS Alarm completely failed with it again.",3,18-12-2019,-1
227,Nancyyt,Good app... but eats your battery pretty fast.,2,14-12-2019,1
228,Andréas Olofsson,I would try the VMA Alarm in the app but it doesn't work!,2,13-12-2019,-1
229,Plaahn ,"Bad sound signal I haven't heard when I received notification of accident!
Get a better signal and the ability to regulate volume.
If possible there is clearer information.",3,12-12-2019,-1
230,1987 et,"Great application, but whether it works is unclear. I receive neither updates in the current feed nor notifications about accidents in my vicinity. Have tried reinstalling the app and checked my settings and it analyzes itself that it should work optimally; To my surprise, it doesn't. Would have liked it to work.",3,10-12-2019,1
231,Lampgubben,Lacks access to a camera to be able to show the situation in the event of a traffic accident,4,03-12-2019,-1
232,Sofia.lindstrom,"The notices on what is current seem to work like that. Sometimes it comes, sometimes it doesn't. Tried reinstalling the app.",2,06-12-2019,1
233,henkanhenkan,"Fantastic good and important app, also nice interface. When is it coming for Apple Watch ??",4,27-11-2019,1
234,Andy7533,"The idea is great. Small misses here and there, such as the alarm signal does not work. Some functions such as important health information that the SOS operator should know, should be visible or sent to SOS during calls to facilitate the work of the ambulance staff.",3,30-11-2019,1
235,Sixten Redlös,"Hello!
Missing the Swedish Transport Administration's phone number for reporting accidents, obstacles, etc.
0771-921 921
They say it every morning on the radio but I never remember it...",4,24-11-2019,-1
236,A. Tetik,"Why can't you select a region if you don't have location services on for notifications?
Or to choose to update region when opening the app. As well as see notifications sent out the same day to that region.",5,26-11-2019,1
237,Bo#1,"makes the app come up when you search for ""112"" on the home screen. had a hard time finding it and it would be good when you're busy and can't think of the app's name. instead I wasted a minute or so completely confused and then I decided to call as usual instead, bad when you're in a hurry and have trouble thinking. otherwise it worked fine another time on my friend's cell phone because they could see the exact position which is great",4,21-11-2019,-1
238,Fredrik344,"Remove info that the app has been used in the last 3 days! Have approved the location information ""Always""!",4,21-11-2019,1
239,eilmaeilma,"I called 112 and they answered as
Usual but then no help came",3,20-11-2019,-1
240,Kecke53,"Want a function where you can enter home address and workplace, then you will receive notifications about these areas. You can avoid the GPS function in the background and that it possibly wastes battery. Keep it the way it looks right now, but feel free to add the home and workplace address function. Thanks",4,29-10-2019,1
241,Shadowdonne,Sad and weird.,1,18-11-2019,-1
242,Lucio00,"The app doesn't work, crashes right away when I try to open it!",5,18-11-2019,0
243,pärans,The app doesn't work I just keep exiting the app when I try to enter it.,2,10-11-2019,0
244,Sändry,It doesn't work at all! I can't even get into the app! Please help me!😢,1,06-11-2019,1
245,någon som kan hjälpa mig?,Why does the app close every time I try to access it?,1,06-11-2019,0
246,Annonym!,Good that you can get information about fires in the area. Wish you could get notifications for shootings and bombings too.,1,06-11-2019,1
247,Hasse45,"Lots of information! Unfortunately not right yet, but nice not to have to.😝. I say 5 stars!🆘🆘❤️❤️",2,06-11-2019,1
248,gubbegubbe123,Would be fun with 3D Touch but it's smooth and good!👍👍👍 Recommended!,5,01-11-2019,1
249,Gustav🆘,"How hard should it be to fix nearby events? Just says network error. Yes, all settings are correct in phone. Even tried reinstalling the app.",5,31-10-2019,-1
250,Bfkfd😃😃,Very good app! Top with coordinates and map. It would be great if you could get the ICE number as well.,4,14-10-2019,1
251,micke.r,I agree that it is missing that you cannot access it in locked mode. I downloaded it earlier but didn't have time to write down my code sp I deleted it to download again and then it doesn't work so now I don't have one at all.,1,23-10-2019,0
252,liinks_,"Very good idea and I like that you get notifications when something happens nearby .

But! When I was about to call 112 the other day when a bomb went off outside my house, I opened the app but couldn't see the phone button. So I was in shock and couldn't make it out in all the blue. Shouldn't an ""emergency button"" be red?",5,23-10-2019,-1
253,Lundeneve,"Thanks to this app, I was able to drive past a traffic accident (by taking a different route) that had blocked the whole town and thus I didn't miss an important appointment, woho! However, I am bothered by the fact that the history of events is not stored. You answer to everyone else that ""it disappears when it is no longer relevant"" but do you know anything about human stress and psychology? How does it feel to have 5-10 notifications in the morning and then not be able to see details for a single thing? Have also received notifications about traffic accidents that have disappeared from the app because, according to you, it is no longer relevant, but just as damned the road is still closed, etc. Really think the history of notices and details should be saved a little longer. Another suggestion is to choose which notifications you want. I don't particularly care about a fire in a building because it's usually someone who burned a pan in the kitchen 2 km away. But traffic accidents seriously affect everyday life, so I like to see that. Thank you!",3,19-10-2019,-1
254,enbs ofnrkfkrnrl,"The app ""disappears"" when you haven't used it for a while. It has to be downloaded again before it can be used, which of course is not good. If you turn off app offloading in the settings, it applies to all apps and it takes memory from the phone, so you don't want to do that.",2,17-10-2019,-1
255,bfdshjdjdkxd,Events have stopped working. Just says network error.,3,17-10-2019,-1
256,Hemulen72,"Can't get map view of current events, only my own position and location of event on a grid.",4,14-10-2019,0
257,iLNWB,Network error all the time,3,13-10-2019,-1
258,brorsan1996,Updated to latest version and app crashes on startup. Restarting the phone or the app does not help. Otherwise a good app.,3,11-10-2019,1
259,Humhunters,"For me, who lives in a densely populated district, it cries wolf with its recurring notices about fire in a building, burning vehicles, etc. I only want to receive explicit notification about a fire if it is really close to me and in other cases avoid notification or receive a more neutral notification text such as ""Event in your immediate area"". As someone else wrote, you still don't see any history. It feels doubly unnecessary to see ""Fire in building"" the first thing you see on your mobile phone on Saturday morning and then see nothing at all in the app. Totally unnecessary anxiety attack. Also want to be able to receive notifications about selected areas, at least my own residence, even when I am elsewhere.",1,12-10-2019,-1
260,Vääldigt missnöjd just nu,"Have a ""dumb phone"". Can I use the app to quickly enter position, and use the registered phone for calls? One problem is that when I start the app it says that my gps in is active, which it is!",4,01-10-2019,-1
261,Johanna Lindh,As previously written - missing a widget so that you can access the app when the screen is locked. Would be great if the kids can access it if something happens to us adults.,4,28-09-2019,1
262,enock nitti,"Great app! Very good way to get quick updates on what is happening in your local area. What is missing, however, is that you can enter your home address so that regardless of where you are, it is possible to get information about any events around your home address, important in the event of a fire, for example.",1,01-10-2019,1
263,CeciliaMT,"Excellent app as I work in the forest with the risks it entails. Then using iWatch with built in phone that has emergency calls built in but why not make this app iWatch compatible?

Good with notifications, but I would like to have the SOS app myself at the top of the ""Dock"", i.e. when you only need to press the oblong button, you get there directly and can raise the alarm if you are stuck under a tree.",4,27-09-2019,1
264,SofLa10,"But lacks history on those alarm that has gone off.
Sees in the notifications on the screen that it was, for example, ""Fire in residence"" but when I go into the app I don't see anything.",4,27-09-2019,-1
265,trygghet i skogen!,"For this app is great, and important. Creates security when moving outside alone. Quick access from lock screen would have been great to make the app even more accessible.",4,26-09-2019,1
266,Stefantony,"In most lighting situations, it's really hard to orientate yourself on the map. If, for example, you receive a warning about an incident and are asked to avoid it and take a different route, it is unfortunately a challenge. The map has a yellow background, roads etc. are drawn in a slightly darker yellow. People with age-related changes in vision, cataracts, blurriness, stress, low light sensitivity or others need higher contrast between important details in the map. Suggest that you replace the map with a clearer one, preferably with the option to switch to a satellite image as an alternative. Then feel free to test it on a number of older people if the change works. It is always good for anyone who finds themselves in a vulnerable situation to know where they are.",4,24-09-2019,-1
267,JHA0228,"A smart app that can always be used! One requirement you should be able to make to Apple, or the respective phone model, is that this app must always be pre-installed. One more thing is that there should be keyboard shortcuts if you need to access it faster than having to log in, find the app, click on the app, let it load, etc. maybe a widget?",5,26-09-2019,1
268,Vet bäst,"Good info, but missing notifications on Apple Watch",4,18-09-2019,-1
269,jeppelele,"A Just a little thought. When you have a notification on and where you can test how your mobile works with the alarm, after you press the test button and then lock the mobile, a notification appears that they were a test. Goes in and clicks / deletes the message about the test. But then they still have a notice in any case, even if you have taken and clicked off the test. They are still there even though I did the test several days ago.",4,17-09-2019,-1
270,SundeGunde,"Annoying that notifications on the phone from the same day/24 hours cannot be found in the app when you go into it. I understand if it needs to be cleared, but 24h still feels like a relevant time period.",3,17-09-2019,1
271,Phenix_123,Sometimes you need to get in touch with the police in silence. Where is that function?,4,15-09-2019,0
272,Tarlet,"Perfect app for all imaginable necessary extremely urgent situations, when you need to be able to quickly alert the right authority.

As others have written, you should also be able to enter personal information about your health, which the healthcare staff may need to know in an emergency situation, where it may be a matter of life or death.
There is also no possibility to enter the contact details of a close relative.

Now there is already the possibility to enter personal information about my health and who can be contacted in an emergency situation, in my iPhone. But it would have been an advantage to also be able to have it in this particular app, so the information is easier to find.

Another problem is that my position on the map does not show exactly where I actually am, as usual with automatic positioning from my Iphone (this time it's an Iphone X).

But why do so many complain that it is not possible to verify their mobile number?
It took me about 5 seconds and I did NOT enter +46, but only my mobile number, so that's my tip for successful verification!

And +46 is the CORRECT country code for Sweden, not +47 as everyone has stated here in the reviews!
Maybe that's why the verification fails, if you can't even enter the correct country number?!

Also, remember that a mobile number should be entered like this if the country code is required; +4670xxxxxx.
So the first zero in the number should ALWAYS be removed, even when calling from a landline (if anyone still has it...)",4,15-09-2019,1
273,Hans3737,Shows errors at 5 km sometimes...,4,11-09-2019,-1
274,LindaLevina,"There's a fire in the neighbor's house. The son's girlfriend wondered if I was ok when she received a notification. I have NOT received any notification. Have checked both the app and the phone's settings. Notices permitted according to all the rules of art.
The event was noted in the app but I got no sound, no tiles as a notification. Lucky it wasn't in my house!
Feels so safe...",5,15-09-2019,1
275,mpegwww,There are warnings when there is a fire or something has happened in the area where you are. I have received two warnings so far and I am very satisfied. It's nice to know that I'll get these alerts that apply to the area I'm in. Highly recommend this app,1,14-09-2019,1
276,Kund sedan lääänge,"112 the app is really good. Got to take and use it in sharp mode. The conversation was clear and concise. However, discovered a bug, the 112 operator lost my position so I had to provide it 2 times. The app should give the position directly, but the app could not send the position unfortunately. Can it be added that I just updated both iOS and the app might have something to do with it!? I think it's a really good app.",1,13-09-2019,1
277,Lena.j,"Missing apartment number and number of stairs
And port code
Sincerely !
Jock
Would love to see a global alarm number
Also missing insurance",5,13-09-2019,1
278,Atlisky,Would like to have it on Applewatch,4,09-09-2019,1
279,multinational_corp,"Good, but can't pick up events nearby!",5,10-09-2019,1
280,Aik2lax10,Downloaded it right away when I saw it. Simple and without too many things to go wrong. As it should be. Should be pre-installed on all phones. One thing you might wish for: the ability to send text messages and pictures. Might be good for both operator and caller?,4,06-09-2019,1
281,Dvcfgkkb,"This has to be one of the most useful apps I have ever installed. You immediately receive a message if something serious has happened in the immediate area.
Today, for example, I received a message about a fire nearby, even before the emergency services had even had time to go out. Invaluable information!!",3,08-09-2019,-1
282,Masse1970,Should be good if you made a function where you could check the history of events..,5,06-09-2019,1
283,TheGlurgh,"Good app when/if the accident is coming, and help is wanted!

Just as good to get up-to-date information about accidents as the Rescue Service tries to do what they are very good at, and get the opportunity to choose a better route and avoid interfering with the Rescue Service's work to help those in need!

Recommended!",5,06-09-2019,1
284,Jeppejeppe165,How happy I was to read about this news! This will make things incredibly easier and ultimately save lives!,4,04-09-2019,1
285,Wreksir Chit,Would have liked to see CPR instructions and defibrillator location in the app. Even syncing with apple watch would have been good.,5,04-09-2019,1
286,Sarah-111,"Can't you add a function so that you can recommend/send the link to the app to those you have in your contacts, so you get even greater spread faster",5,04-09-2019,1
287,Lärkan,A smart app that everyone should his mobile👍,4,01-09-2019,1
288,Jocke Oscarsson,Great app!,5,03-09-2019,1
289,Katoden,"I can't download the app. The ""Download"" button does not exist ...",5,03-09-2019,0
290,Masse mas,"Good that an app is coming out to contact 112! Fortunately, I haven't had to use it yet, so it's hard to give a rating.

Would like to see that you could enter voluntary information such as who you are, next of kin, important disease information, etc.",5,03-09-2019,1
291,Boel1,"Good and important app. In the profile you should be able to enter important personal information such as diseases, disabilities, allergies, blood group, next of kin which is automatically sent to SOS together with location.",1,02-09-2019,1
292,Callr Gr,"Good to have on the phone, but it would have been better if it worked .",3,01-09-2019,1
293,antelovikavante,"Good app, but sucks the battery unfortunately.",4,28-08-2019,-1
294,livräddarna,"Great app that everyone should have!
It would have been even better if you could enter your home address to receive notifications about, for example, a fire in your residential area when you are not at home.",1,01-09-2019,1
295,Halmstadbo,"Since I installed the app in the phone, the phone draws a lot of power. Then I still have it in place-when in use.",2,31-08-2019,0
296,Tungviktsfinal,"Stylish, simple and consumes almost no battery.",5,31-08-2019,-1
297,vickemelman,"Good functions. Since one has to use the app for the location information to be shared when calling 112, it would be valuable if support was implemented for making calls with the app using the phone's voice assistant. For people who are not tech savvy, and for people who use assistive devices, it can take a relatively long time to first bring up the app, and then get to the right menu selection.",2,30-08-2019,1
298,LKAS48,"A good start but missing a few things, where is the connection to the Apple Watch, especially The e-sim models where you don't even need a phone?
The Apple Watch has a function where it calls if the watch registers a fall and you don't react, i.e. you are probably lifeless and then automatically calls 112. How do you handle such an alarm?",5,30-08-2019,-1
299,Per Rosqvist,"Good app, but discovered that ""something"" sometimes happens with transmission of positioning data, e.g. via SMS The phone shows the correct position, but a different position is transmitted in the message

Took screenshot which I am happy to share. Almost a mile apart",5,30-08-2019,1
300,Sotarus,"Great app ✌️
Does it also work on the iPad to alarm?",4,27-08-2019,1
301,m4rber63,An app that can save lives! Got two notifications.,5,28-08-2019,1
302,Maldini79,I would love to have an app for Apple Watch as well because I sometimes leave my phone at home when I run and only have my Apple Watch.,3,28-08-2019,1
303,apanadam,SOS Alarm sends information about events in my vicinity so the app always needs to position itself . My location is only sent to SOS when I call 112 via the app. The app also seems frugal with the battery. A must for everyone in Sweden!,5,28-08-2019,-1
304,TheVilLion,"Great idea and the app is very user friendly! However, you have to work a little with the GPS. Sitting at home at the kitchen table and then the app shows that I'm 300m away from my actual position.",5,28-08-2019,1
305,Zldnny,"Hope I never have to use the app, but when I do I want to be able to search for ""112"" on the phone, so please make it searchable now shall call it the 112 app. Now you have to look it up manually or remember it's called SOS Alarm.",5,28-08-2019,1
306,Maxenhogis,"Very important app that can save lives!

Agree with other reviewers that a messaging feature should be added to allow reachability for those who cannot speak or are in situations where the distressed cannot speak.

Being able to somehow reach the app if the screen is locked is very desirable, but it may be difficult as the technology rather lies with the mobile manufacturer.

More languages ​​would also be good.",3,28-08-2019,1
307,anderslager,"Good idea, but I don't get SMS with verification code. Yes, it's the right phone number and I've uninstalled the app twice...",5,28-08-2019,1
308,zzmmttddiihhääqqxa,"Would be great if you could enter phone numbers for relatives.
So they get word of what happened.
 
Jan-Peter Glans",5,27-08-2019,1
309,MumsMums61,"When you search for the app, you don't get a hit when you type ""112"" in the iOS search function. I'm guessing that some meta tag is needed.
You get a hit on ""Sos"" but not ""112"".
I think that would be great!
Unfortunately (or fortunately?) I haven't tested the app's functionality.",1,27-08-2019,1
310,Jpglans,"If I enter my position, it shows the completely wrong position.",3,27-08-2019,-1
311,Ann080,"Because the app is so easy to use in case of accidents as you can call from it and SOS can see your position without that you yourself have an inkling of where you are, can't you add a function where you as a user can agree to share your position at all times?

That is, if you have chosen to share your location all the time, you are not only visible when you use the app yourself in the event of an accident, but you can also be found if you yourself disappear due to an accident/crime where SOS can track you after a police report has been made.

Now the position may already be shared regardless, but if you want to be able to be tracked even though you don't report an accident, for example, but have been hit yourself, then you have to agree to it, right? Then no triangulations or other active tracking apps are needed. Just a thought....",3,27-08-2019,1
312,Kollekock,Good first impression but calls for an English option for those who don't yet master Swedish,2,27-08-2019,1
313,Warulfven,"People complain about not being able to verify their number. Just enter your number as usual. In my case 070x-xxXXxx.
No +47 etc!
And so the problem is solved, it hardly gets simpler than that.",4,27-08-2019,-1
314,NickRidd,"Good! However, I would like to see a map with all the local live data. - Where is the ambulance going on the street? - Why does the area smell like smoke? Know that DN.se had such a service (from SOS) before. Thank you!",3,27-08-2019,1
315,MobilTorsk,"Important app, and I hope the developers add more languages ​​to the app as soon as possible so that everyone visiting Sweden can use it fully.",5,27-08-2019,1
316,Little Bobby Tables,"Have been waiting for this app for a long time.
One tip is to also develop the app for ""smart watches"".",3,27-08-2019,1
317,Bjälken,"That this app is also aimed for only people with Swedish Apple accounts is just idiotic. Such an app should be available for any account, foreigners and tourists would definitely have a harder time to exactly tell his or her whereabouts in a case of emergency.

Do as other SOS organizations have done, publish the app in all Apple AppStores and at least add English to the set of languages ​​within the app.",3,27-08-2019,-1
318,Hobster001,"Let the user choose if they want to share the position all the time or only during calls.
Being able to choose which city/location you want VMA for would also be a clear advantage.",5,27-08-2019,1
319,Phegazuz,"Hello! Don't want to seem negative or skeptical.
Great app etc!! Thumbs up!!
But...will more cases be investigated now? Or is the app ""mainly for"" to ""calm the anxiety"" and increase the ""feeling"" of security?
Did the police suddenly get more resources and staffing to investigate crimes with the help of the app?
Again...pardon the skeptical tone! I mean well and am extremely pro-police and justice.",1,27-08-2019,1
320,stga77,"Is it coming to Apple Watch too?
Very good otherwise.",4,26-08-2019,1
321,mastersoftheuniverse.se,"Have entered my mobile number 7 times with +47 as you should do plus usual but complains every time that (The given phone number is not valid, please try again) Really good start to an app you had hope for and it always has to be a hassle some 🙈",5,27-08-2019,1
322,Lordmanfred,"I can't verify my phone number, either with +46xxxxx, 0046xxxxx or 0xxxxxx.",5,26-08-2019,1
323,Daniel Elbl,"It is not possible to add a phone number on an iPhone SE/5/5s.
The keyboard covers the button.

Try better!!",1,26-08-2019,1
324,Är alla nicks tagna eller!?,"Countless times I have tried to enter my number. In other ways, for example, it doesn't work!",1,26-08-2019,1
325,Sverber,"Important app that can be decisive in stressful situations.
However, you want to see that the app sends the position even if you call 112. In case of serious damage, it is not always easy to fiddle with apps. Or even unlock the phone.",3,26-08-2019,-1
326,J.u.g.o,"'Network error, try again later' and 'could not refresh feed'.

Enough because many just downloaded the app but when something happens even more will try to get info, from servers that cannot be reached..

Well, nothing I would rely on, sad.

..and screw up google analytics (shit frivolous move by junior developers)",1,26-08-2019,-1
327,Murtein,Surely a very useful app but the phone number couldn't be entered.,5,26-08-2019,1
