,Review Id,User Name,Review,Rating,Date of Review,reviewCreatedVersion,Sentiment
317,70bae249-2b9e-4abd-b81a-98a9614c38c7,Googlen käyttäjä,"The official announcement page says that positioning is not in use, but on the front page there is positioning works.",5,22-04-2020,3.1.0,0
318,766f96db-d502-4bda-bbc4-f694aae9e6ef,Googlen käyttäjä,"21.4. the published app states on the official information page that it cannot display local information because it has the right to location data -- even though it is, GPS is on and the accuracy on the App's front page is 16m?",4,22-04-2020,3.1.0,0
319,1b520766-7d23-4cad-8198-e64d6b847cf9,Googlen käyttäjä,No user experience yet.,3,22-04-2020,3.1.0,-1
320,249e5e4f-3240-450f-8296-7cf580b6b505,Googlen käyttäjä,Creates security to get help at the right address!,4,22-04-2020,2.0.0,1
321,262c4702-fb72-4f43-9705-2399973e9cce,Googlen käyttäjä,"Haven't had to use it yet, but positioning works. ",5,22-04-2020,3.1.0,0
322,8505ae12-bf4e-486a-8c53-bb844daf03c1,Googlen käyttäjä,place on the map?,5,21-04-2020,2.0.0,0
323,4b425628-27d8-4b02-83a7-1454b3925fd3,Googlen käyttäjä,definitely the right choice for the phone,2,19-04-2020,2.0.0,1
324,fbe02862-fb62-44a8-bb2d-f31d325b4416,Googlen käyttäjä,"This is wifi on the tablet no. Note that when you type in the subject of someone's rescue number, the phone number will be displayed and then you can call the number with the right phone.",4,16-04-2020,2.0.0,1
325,2a872328-0791-4cfd-8f64-cb49590f6985,Googlen käyttäjä,The cabin is more valuable than gold🤓😄,5,14-04-2020,2.0.0,1
326,3c81c4fd-885d-4f1e-9f5b-9ac6ccb8ff85,Googlen käyttäjä,Good app!!! Please download!!!!,5,12-04-2020,2.0.0,1
327,ffc6809d-1f14-47c9-bc7a-2d02931e9bed,Googlen käyttäjä,Good application,5,09-04-2020,2.0.0,1
328,c6fc3d7a-244e-4131-a53a-f6611c7c1270,Googlen käyttäjä,"Good idea, also e.g. Kela link",5,08-04-2020,2.0.0,1
329,3d3e84a5-b45e-400e-a4cf-afa8cdebc381,Googlen käyttäjä,Corona reference numbers for updates or even links where to find them! Warm Thanks for the important app!,3,31-03-2020,2.0.0,1
330,bbbbb1fc-d4d2-40f0-ab76-7b60c6a22705,Googlen käyttäjä,I wonder why there is no announcement about the corona.,3,21-03-2020,2.0.0,-1
331,f665c884-d879-4dfe-95c2-e22fdd0559ab,Googlen käyttäjä,Luckily I haven't needed it yet. thank you,3,17-03-2020,2.0.0,1
332,820b19d2-9675-43a6-962e-35daadab1341,Googlen käyttäjä,Life saving,3,16-03-2020,2.0.0,0
333,793dc6a8-45c0-48eb-bbef-d25af9065701,Googlen käyttäjä,Thank you very much yum,5,16-03-2020,2.0.0,1
334,1948f625-27ab-4430-bdc9-cd1228fb35a1,Googlen käyttäjä,Wonderful stuff.Saves lives!,5,11-03-2020,2.0.0,1
335,9946b9e5-07cb-4b18-ae18-1599dbfe24d7,Googlen käyttäjä,Working app.,5,06-03-2020,2.0.0,0
336,e08f6217-f4bc-4258-90bf-e5c1889e4ce0,Googlen käyttäjä,I can't say,4,28-02-2020,2.0.0,0
337,bc32ea44-951e-4807-a9a4-8dbc32f647c2,Googlen käyttäjä,JUHO WIFI USB809809USB,4,18-02-2020,2.0.0,0
338,66c173ee-b826-4f1e-b4b8-5380351538c7,Googlen käyttäjä," Hopefully we won't need this, but it seems to be functional, easy to use, and reasonably versatile.",4,12-02-2020,2.0.0,1
339,1aed9a21-e737-4120-b0b5-b43408963eb8,Googlen käyttäjä,Vsrmssn works great. Olavipoika Kokkola!,5,11-02-2020,2.0.0,1
340,ed0cab55-e6de-4348-9446-0aaf416b9459,Googlen käyttäjä,Good,5,11-02-2020,2.0.0,1
341,31894623-7f4b-4258-803b-dda68ee73dbc,Googlen käyttäjä,Good you can't find this,4,11-02-2020,2.0.0,1
342,282c8b59-4dcd-4737-9fef-40961379c63d,Googlen käyttäjä,"Good, easy and fast to use",5,02-02-2020,2.0.0,1
343,d5a2067c-489e-4eea-a8ed-5a2e0db4777a,Googlen käyttäjä,Makes positioning easier,4,30-01-2020,2.0.0,1
344,07a974a7-921a-4d66-9ccd-e07720286ed9,Googlen käyttäjä,"Works, I even used it once. I am now deleting the application, because it consumed 11% of the battery during 10 hours of using the phone. I hope they fix the app to be lighter when not in use...",5,23-01-2020,2.0.19433,1
345,d0e1f7db-fc50-41db-9740-ae492c3da933,Googlen käyttäjä,Awesome,4,22-01-2020,2.0.0,1
346,bfeb9644-4e51-46b3-85e1-1aa489a16d6c,Googlen käyttäjä,Ok,5,22-01-2020,2.0.0,1
347,2937d0fd-811b-42f3-b3e5-d5f603e5c18d,Googlen käyttäjä,This app is a must have!,4,19-01-2020,2.0.0,0
348,0e21757c-1cc9-4fd8-abbb-bea34458881c,Googlen käyttäjä,The application stays on after use and cannot be turned off.,5,14-01-2020,2.0.0,0
349,48ec46aa-f367-4d9f-975c-f0ea4a9d14ea,Googlen käyttäjä,Good,2,10-01-2020,2.0.0,1
350,4ef0b88f-cd57-4ce5-919f-3b6c967226d2,Googlen käyttäjä,"Positioning in the background all the time, not good. The application started on the phone.",5,08-01-2020,2.0.0,-1
351,52114d60-e314-4000-8a14-7c706ec5fedf,Googlen käyttäjä,Useful,1,07-01-2020,2.0.19433,1
352,d9e73633-da2b-48f3-a57c-f10c6f5cb54e,Googlen käyttäjä,Very necessary,5,05-01-2020,2.0.19433,0
353,3d37072e-1c7f-471a-a98c-2fc287032ffe,Googlen käyttäjä,"Positioning did not work, but had to tell the exact coordinates.",5,04-01-2020,2.0.19433,0
354,514128ea-97c1-4c4d-87f8-f4310f4d5a33,Googlen käyttäjä,Perfect and safe because the coordinates of your location are shown directly to the institution.,4,31-12-2019,2.0.0,1
355,f5a4f44d-dd6e-4748-ae56-6e1b57426a81,Googlen käyttäjä,Very important.,5,29-12-2019,2.0.0,1
356,8b595f67-b6fc-4cc7-9e60-5fe72b20ea46,Googlen käyttäjä,Now you don't need to know the location,5,26-12-2019,2.0.19433,0
357,d5b22e1d-3536-43b7-82a2-f09a5acadd48,Googlen käyttäjä,REALLY Good!!!,4,23-12-2019,2.0.0,1
358,9d3adb1a-a720-47e5-b1d5-85eb9a47ca22,Googlen käyttäjä,The best application ever,5,17-12-2019,2.0.19433,1
359,919ba456-879c-4379-8f57-7b34f0c09a77,Googlen käyttäjä,"I'm selling there are problems with TUKKA, you can't know if it's perfectly good and the whole thing works is that, but the fact that when it's been there has been so much that if there's a need, it's just fine the same as the thing has never been any problems, it can't be you there is nothing to do",5,14-12-2019,2.0.19433,1
360,953cee53-9a6f-4327-9053-dbc65a0778d0,Googlen käyttäjä,It claims that positioning is not on even though it is on and that is why the coordinates are not displayed. Can this be fixed?,5,11-12-2019,2.0.19433,0
361,1553cc77-366c-4b69-8a8e-c637533a4655,Googlen käyttäjä,"After all, Androids already have emergency location software. That's why 2 stars off because of ""bloatware""",3,08-12-2019,2.0.19433,-1
362,98d548e2-c10c-42b8-adc3-35ade149727a,Googlen käyttäjä,Appreciated and indicates the place. Requires continuous use of the GPS application,3,07-12-2019,2.0.19433,1
363,42ae2588-5cf9-4284-b1ff-38fbd9c4e6fb,Googlen käyttäjä,No need to key in numbers,5,04-12-2019,2.0.19433,-1
364,cfbd6ea1-eede-4f69-8b72-42ae4b2e48f1,Googlen käyttäjä,Can't it be made so that it automatically turns on the GPS when you open the application? Who the hell starts turning it on.. and it takes the battery if you keep it on all the time,5,02-12-2019,2.0.19433,-1
365,be4f5b87-859f-49ab-9e05-c12b0613c79f,Googlen käyttäjä,I turned on the location and it still doesn't know where I was,4,01-12-2019,2.0.19433,0
366,ff36441b-d519-4db8-b74f-1efbfd3e7737,Googlen käyttäjä,Plööt🦃,2,29-11-2019,2.0.19433,0
367,bce85b5e-ea57-4bbb-8acd-1f9cc1a51538,Googlen käyttäjä,Works in a real situation!,5,27-11-2019,2.0.19433,0
368,45df4ff9-d289-40bf-b004-f6f2a61e0cb4,Googlen käyttäjä,Could you get the possibility to share this danger message to e.g. a Whatsapp group.,5,23-11-2019,2.0.19433,-1
369,aad71d8d-2216-4cb7-9dab-c2a38289bb51,Googlen käyttäjä,Important application,5,23-11-2019,2.0.19433,1
370,10ad3b30-b064-4221-ba97-b76188991bde,Googlen käyttäjä,Shows constantly notification that uses the location in the background. Also when no phone calls have been made through the application.,5,22-11-2019,2.0.19433,-1
371,42ecab14-f089-441c-b341-8257fa7245a4,Googlen käyttäjä,I only gave one star and deleted the application because there are some pointless notifications in the style of a moose fell in Lappeenranta. You can't remove those notifications from the settings.,1,22-11-2019,2.0.19433,0
372,bd41a334-216a-47fd-a6f0-41900f27e942,Googlen käyttäjä,Could save someone's life,1,22-11-2019,2.0.19433,1
373,80331199-5476-446d-b4ca-c722591c8183,Googlen käyttäjä,"Turned on the positioning this morning on my own. When trying to open the app, it flashed the opening screen and shut down. Kept the location active until the restart.",5,22-11-2019,2.0.19433,1
374,573f50f0-6e48-4d4d-894c-b3f20ca6a303,Googlen käyttäjä,"Otherwise good, but the application keeps tracking the location in the background. Need to force closet. Stupid.",2,20-11-2019,2.0.0,-1
375,7f5f8fce-0e1a-4242-9542-43cf99a5cf8d,Googlen käyttäjä,"Damn useless, they didn't even know how to help.. I was beaten and my friend was beaten, they didn't even look at the security cameras outside the store to check...... Are they trained at all anymore???",2,19-11-2019,2.0.19433,-1
376,f2c96e16-ef79-40ce-8702-b05917b46e83,Googlen käyttäjä,"You can't call an ambulance directly. It must be keyed from the keyboard. Otherwise, everyone should be smart.",1,13-11-2019,2.0.19433,1
377,b999fd6b-b0ac-4134-bc3f-1d89ed9ed363,Googlen käyttäjä,"Good and useful. Danger notices are a good plus, and other emergency numbers can be found in the application. Quite a few people have complained that positioning remains on after a call. If you have read the terms of use at all, you have accepted the collection of location data for a maximum of one hour after the last call. If you have had the collection of location data in the notification bar for more than an hour, you can forcefully stop it from the settings :D If the collection of location data has NOT been used for an hour, do not close it.",4,10-11-2019,2.0.19433,1
378,7dba8596-039b-449a-8a98-db969465123a,Googlen käyttäjä,"It has been necessary many times. The location information itself has never once been helpful in my situations, but if, for example, I broke a leg or got stuck somewhere in the forest, positioning could be a great help. Also, the fact that in the application you can find e.g. the telephone number of the poison control center quickly speeds up getting help. There haven't been any official announcements yet - I hope it really works. Maybe they could make some test reports to verify functionality.",5,09-11-2019,2.0.19433,1
379,22b74c08-9361-45c7-b8a6-7420a58b3f64,Googlen käyttäjä,Omelet Instructions Start making the omelette by breaking the structure of the eggs in a bowl by beating them with a fork. Add milk and spices. ... Pour the egg mixture into the pan. Lower the heat. ... Put the lid on the omelette and let it congeal/cook for a while. ... Offer an omelette as a snack or with a salad as a small meal.,5,08-11-2019,2.0.19433,-1
380,86d99fe8-d53c-4756-8d2d-991862c1ff46,Googlen käyttäjä,"Location remains on even if you restart the phone. An unimaginably bad bug in such a simple software. If you can, you can kill the program through the settings. The 911 location is great in itself, I just used it in a strange place, but for God's sake please fix that bug.",3,06-11-2019,2.0.19433,0
381,356c1f4c-094a-401d-b526-ad66c915e18d,Googlen käyttäjä,Easy,2,30-10-2019,2.0.19433,1
382,62c14135-cc3c-4249-822f-054efeb66874,Googlen käyttäjä,It's a very safe app you should really use it,5,27-10-2019,2.0.19433,1
383,f630d141-9c5b-4c69-b6f9-ee8000315ef5,Googlen käyttäjä,Good to be.,5,23-10-2019,2.0.19433,1
384,8e96ccdd-a9fb-4d9b-8dc7-5b944f99a734,Googlen käyttäjä,0/5,5,22-10-2019,2.0.19433,0
385,55f83cd2-dab1-49e0-9739-5b71b754ba69,Googlen käyttäjä,"Thank you for being there. I respect the police, ambulance personnel and other rescue personnel. You are doing really demanding and valuable work. Thank you for this great 112 app that can alert you quickly for help.🌻🌹🌼🌸🌺",1,12-10-2019,1.1.145,1
386,2fd50b81-70bf-4dcc-b4aa-0ff5dc0f290c,Googlen käyttäjä,"Good app. Really useful. If you don't know how to give the location exactly right, the emergency center will get it accurately based on the location of the phone and help will be quickly delivered to the right place.",5,12-10-2019,2.0.19433,1
387,56b7f7d7-1f77-4d80-aaf2-94664cc6bf2a,Googlen käyttäjä,Are the emergency numbers related to mental health coming to the application?,5,03-10-2019,2.0.19433,-1
388,83e8e8d7-3052-4ef7-8054-aef00d0d6c9e,Googlen käyttäjä,The application works well and you can find the most important numbers there.,5,03-10-2019,2.0.19433,1
389,9a730d09-012d-4c7e-af9b-8bb2f71c47b2,Googlen käyttäjä,"Absolutely wonderful! Even today, the person in need of help quickly got help at the right address. ",4,28-09-2019,2.0.19433,1
390,8dba9815-2c64-4965-9bc2-e20c1108530e,Googlen käyttäjä,The location remains on after the call. It only turns off when you force the end of the program.,5,19-09-2019,2.0.19433,0
391,b6808878-a839-4b75-820b-2ae6546f990a,Googlen käyttäjä,228fass,2,18-09-2019,2.0.19433,0
392,be7a1735-6a09-41f2-a598-476a780ad673,Googlen käyttäjä,Fast and safe,1,15-09-2019,2.0.19433,1
393,ad45efdd-04f9-471e-ac58-de38e740b44a,Googlen käyttäjä,good,5,14-09-2019,1.2.9,1
394,cd019099-7e52-4212-a8f4-7c1bbda28b29,Googlen käyttäjä,"Good idea, but I removed the installation because it keeps the positioning on all the time",5,14-09-2019,1.2.9,1
395,7385db1b-fc22-4760-bd0b-5d5bd9c66b44,Googlen käyttäjä,Really needed!!,4,13-09-2019,1.1.145,0
396,332b4d2d-714f-4ca0-bbbb-1591659c0791,Googlen käyttäjä,Good service.,5,04-09-2019,2.0.19433,1
397,3d45a734-d5f5-44b7-9a05-c62782e70915,Googlen käyttäjä,Good to know where o,5,30-08-2019,2.0.19433,1
398,3f4989f6-f6af-434a-9ab2-b9e5474072a5,Googlen käyttäjä,No user experience yet,5,28-08-2019,2.0.19433,-1
399,0fe12a83-dcc9-4431-8b57-ab0883d58e41,Googlen käyttäjä,"Positioning in the background every once after restarting the phone, a big minus. I always have to force close the application from the mobile settings. However, it's useful, so I wouldn't want to delete it.",5,19-08-2019,1.2.9,1
400,7a789604-437e-4c65-b37f-b140b5743ef5,Googlen käyttäjä,Top,2,18-08-2019,2.0.19433,1
401,6c371256-eb72-4b7a-8acc-9f8a1b8c5228,Googlen käyttäjä,"Once the parrots escaped, I got it if you want to read Liisa's messages, press Savo's messages and put Aleksi's escape from the parrot",5,13-08-2019,1.2.9,1
402,59da6cc6-e951-488d-96cc-9f849118ba10,Googlen käyttäjä,It doesn't open.,5,09-08-2019,2.0.19433,0
403,37962b0f-ae5a-4c11-830d-429b6177ce4f,Googlen käyttäjä,It doesn't,1,06-08-2019,1.2.9,0
404,eba797df-3cd9-4dfa-9447-56eabeec240e,Googlen käyttäjä,"It's good because if you don't know where it is and there's an emergency, you can call 112 and they will locate you",2,29-07-2019,2.0.19433,1
405,0e3d3259-648d-43ab-bbcd-b67dc8242ce2,Googlen käyttäjä,"If you hope you don't end up at the scene of an accident, this will inform everyone about the location.. All you have to do is call 112 in a strange place, you YOURSELF don't know where help is needed!!! DOWNLOAD NOW!!!",5,28-07-2019,2.0.19433,-1
406,846c37a7-7d70-4a6c-bb54-ff8ed9251f29,Googlen käyttäjä,Location remains on after using the application. The Dual-SIM phone is not affected by the location if you mistakenly call another number.,5,27-07-2019,2.0.19433,-1
407,382eb2ef-f12d-4e49-8400-154e32d30d8c,Googlen käyttäjä,"Terrible quality: - Called one of my friends first - Location logo remains on. More info: I called using the app. When I pressed call from the app late at night, the phone started calling one of my friends first. I had to hang up and call normally. After this, the positioning remains on even if you restart the phone.",2,25-07-2019,2.0.19433,1
408,151d1029-8bf6-4199-92d8-5007c27d60b2,Googlen käyttäjä,Okay,2,21-07-2019,2.0.19433,1
409,69e711b4-f4aa-4501-af4a-784ba876c65d,Googlen käyttäjä,"From the emergency numbers, when you select sea rescue, do you give the number of the poison control center?",5,19-07-2019,2.0.19433,-1
410,73bbc582-5605-4a0f-a9f9-38be737888bd,Googlen käyttäjä,ok,4,14-07-2019,2.0.19433,1
411,24b59601-927a-47ca-9934-5483395aae85,Googlen käyttäjä,really good application. I highly recommend♡😊,5,06-07-2019,2.0.19433,1
412,62f6e19e-208a-4650-8a37-6b0554043ae9,Googlen käyttäjä,"not working, after the update on 21/01/2019",5,04-07-2019,2.0.19433,0
413,b2c35aa2-c350-4564-975c-4604a1d24310,Googlen käyttäjä,the best that can be found,3,03-07-2019,1.2.9,1
414,311234ed-45d2-4865-92e2-1140af29334e,Googlen käyttäjä,"In order to get a working connection to the emergency center 🖥️⌨️🖱️🗺️📍🎧📞 in an emergency 🆘🚨, I suggest the 5G connection 📱🗼📶🔌support 112 Suomi 📱 application.",5,01-07-2019,2.0.19433,-1
415,50fa8b14-2834-450d-852f-854c045f7e60,Googlen käyttäjä, Damn bad. Didn't work in real situation.,5,30-06-2019,1.2.9,-1
416,db8739b6-91f5-49d8-8744-3d7c0b55b7a9,Googlen käyttäjä,"became really slow to open in an urgent case, bad wait for the start screen for 5-10 seconds...",1,29-06-2019,2.0.19433,-1
417,e201eae5-b41d-49e1-9bc5-e0c2eb1eeebf,Googlen käyttäjä,these services are always needed,3,27-06-2019,2.0.19433,0
418,62de867e-cda7-42eb-a3ec-f9052cb68f7d,Googlen käyttäjä,"good and functional! 👌🏼 the only problem is that six hours after the call, it still says ""the application uses location in the background"" at the top and this doesn't go away even if the device is restarted. I'm starting to wear a tinfoil hat. 😶 Fobat follows my movements!! 😅 edit. The 24-hour visible tracking is now on. I'm almost starting to regret that I called the junkie for help.",5,27-06-2019,2.0.19433,1
419,f2cf6098-8f1f-46e5-b212-b9c70b81a325,Googlen käyttäjä,05-May,2,24-06-2019,2.0.19433,0
420,aeb67ef7-5747-4db6-911d-5dae4efd17df,Googlen käyttäjä,good,5,20-06-2019,2.0.19433,1
421,8f01bfe6-8b0e-4d60-aab0-b6b469262885,Googlen käyttäjä,"Really good, even though I haven't had to call, there is still a good app here, for example crisis phone, etc.",5,15-06-2019,2.0.19433,1
422,3f517682-0ab9-4ffc-b600-0590347affa8,Googlen käyttäjä,"experience is, the arrival of help at the scene of an accident is fast, when the exact location of the accident is known with the help of the app.",5,15-06-2019,2.0.19433,-1
423,8ac5326c-89d0-4824-a199-ffda37d9972a,Googlen käyttäjä, Want all possible permissions,5,15-06-2019,2.0.19433,1
424,a7d564e5-9e27-40f2-b0cd-92e7f19e0f80,Googlen käyttäjä,Good,1,13-06-2019,1.2.9,1
425,8e5241d4-8d58-404d-9799-d80dbabccfe6,Googlen käyttäjä,Nice app,5,13-06-2019,2.0.19433,1
426,47406f7e-27a4-48a7-8232-55f7d6213caf,Googlen käyttäjä,No experience yet,5,10-06-2019,2.0.19433,-1
427,392f5fe8-e45a-4c8f-a9e4-c5b10dcf7a5d,Googlen käyttäjä,ok.good😅,5,07-06-2019,2.0.19433,1
428,9bd9c56c-2f07-4d43-8456-da60405789fb,Googlen käyttäjä,handy,4,06-06-2019,2.0.19433,0
429,b83f8ce4-2b8b-43be-854a-b21b0dc195a7,Googlen käyttäjä,good,4,05-06-2019,2.0.19433,1
430,d99d25a2-d093-417d-9ecb-15d76d120aea,Googlen käyttäjä,Good and necessary apps,5,02-06-2019,2.0.19433,1
431,9845336e-f45d-404c-a124-026f291eb912,Googlen käyttäjä,Good,4,01-06-2019,1.2.9,1
432,4243f6ad-5892-4880-99dd-f2826f55750c,Googlen käyttäjä,Still don't know if this is available and from where!,5,31-05-2019,2.0.19433,0
433,ce80694b-ca8f-4431-9633-aae1d304d6cb,Googlen käyttäjä,I have installed this on all mobile devices I manage.,1,31-05-2019,2.0.19433,0
434,323247a7-7ac0-46b4-836b-12c6fe8c5e4e,Googlen käyttäjä,really good ,5,28-05-2019,2.0.19433,1
435,be937e60-ae6d-49b0-8d9e-837c0495507b,Googlen käyttäjä,Hell,5,28-05-2019,1.2.9,-1
436,665f47ec-5437-41b7-a29e-c123223a3d12,Googlen käyttäjä,"After the emergency call, the location was on all the time.",1,23-05-2019,2.0.19433,-1
437,ea04ab14-586a-44d5-8d6e-bafc1a1ddf75,Googlen käyttäjä,"The keys came to the right place, but in the emergency center it says an unknown place.",1,22-05-2019,2.0.19433,-1
438,ce61882e-2c17-4242-b976-8c0b15dc255e,Googlen käyttäjä,"Definitely a good application in an emergency, but started the call with the key lock on and no longer agreed to end the call.",5,19-05-2019,2.0.19433,-1
439,ee5f2620-33c1-41a7-93c1-115831a1a84a,Googlen käyttäjä,excellent,2,17-05-2019,1.1.145,1
440,7c865866-2680-4623-8719-dd963ab4b716,Googlen käyttäjä,Good,5,08-05-2019,2.0.19433,1
441,2e07424a-8e43-41ba-9875-df2f468626be,Googlen käyttäjä,good,5,04-05-2019,1.2.9,1
442,b074790a-9819-4a09-a771-3da0e242de7b,Googlen käyttäjä,"Right to remove SD card content? Why? And a few other access rights are a bit surprising... It takes quite a lot of space and after reading other reviews, it won't be installed.",5,26-04-2019,2.0.19433,1
443,60f1d2cb-a890-442e-90b3-4f409a629948,Googlen käyttäjä,important,1,19-04-2019,1.2.9,1
444,b998af4a-bc33-40f2-b2ad-51659b323ba0,Googlen käyttäjä,"The latest update is the wrong size, it downloads 10.81MB and expects to get 10.29MB, so it won't install either even if I clear the caches and start the phone ",5,14-04-2019,2.0.19433,-1
445,9b534a33-dc6c-4e22-bb7d-e032d017888a,Googlen käyttäjä,hji,1,12-04-2019,1.2.9,0
446,0edf30ff-aef0-41ff-88bf-b1b1f6560b0d,Googlen käyttäjä,"this works, please use it.",4,10-04-2019,1.2.9,1
447,4de7e712-319e-4008-9580-ea27935dd49b,Googlen käyttäjä,Really good,5,06-04-2019,1.2.9,1
448,c121f5c8-8080-4dc0-a96d-58f19e48ee7c,Googlen käyttäjä,"I called the ambulance to my mother at 17:15. The man who answered asked a lot and confirmed the address. Now I called again at 9:17 p.m., because I can't hear or see the launch. First a man answered, hung up very quickly and confirmed the address. After that transferred the call elsewhere. The woman answered and finally made the lance come. My previous call cannot be found in the system, as if I hadn't called the cage. It makes me wonder where the first call went.. Based on the questions, there was no reason to doubt that help would come",5,06-04-2019,2.0.19433,-1
449,f6431ab7-6a64-4e47-b308-132a7dff9bee,Googlen käyttäjä,safe life,2,05-04-2019,2.0.19433,1
450,c7c44283-598b-435a-86b0-f6c25d2e3f0e,Googlen käyttäjä,convenient,5,02-04-2019,2.0.19433,0
451,438dcdc1-98e6-4b03-a7ee-9a237a37f020,Googlen käyttäjä,"the location feature of the application is misused all the time, why is the phone located by the application even though the application is not used?",5,01-04-2019,2.0.19433,0
452,36fab5dc-1a17-4049-8b17-2dfd2a36ff44,Googlen käyttäjä,"I tried to call an ambulance for my child, and this application called when I pressed the round 112 button to my school friend from years ago in the middle of the night and it took a long time to get out of the application. In addition, the application asks for a phone number when downloading and sometimes otherwise. Why on earth? In an emergency, it's hard to remember anything and that kind of pointless typing wastes time and can prevent, for example, a child from calling with an app that doesn't even know the phone number. I would expect a change to this.",1,28-03-2019,1.2.9,1
453,ea5841a4-2d19-4824-ac29-da982176991a,Googlen käyttäjä,Important application,2,27-03-2019,2.0.19433,1
454,34de337e-58b5-44c5-b1a6-0b550a161c06,Googlen käyttäjä,"I couldn't find an application in a real emergency, but Android now transmits the coordinates to the cage. They didn't ask much about the location, of course I gave the address. However, when calling the emergency number for the first time, the phone must be given permission to transmit location information. I used the application later to call the road user's line and the result was terrible battery consumption, now that the application wants to locate all the time. So in summary, in the Android world, a somewhat pointless application that consumes the beginning.",5,26-03-2019,2.0.19433,-1
455,aaa2d6bd-f1e3-4ce4-aec0-83f9a1caaf65,Googlen käyttäjä,new version won't install,2,24-03-2019,1.2.9,0
456,be548354-b86f-400d-9715-f5a9603fc113,Googlen käyttäjä,I haven't used it yet...,2,16-03-2019,1.2.9,0
457,4df95700-32b0-43a2-912c-28f5357538a3,Googlen käyttäjä,Crap,4,13-03-2019,2.0.19433,-1
458,cbf9d027-6855-4300-a757-44f3869cec48,Googlen käyttäjä,"Clear user interface. In an emergency, it certainly makes contacting the emergency center easier and faster. But there should already be some instructions on Google Play. The program does not call the emergency center directly when you open it. And on the first startup, you have to tap your own phone number. At least this would be good to say. In an emergency, remembering your own number just takes a lot of time.",1,13-03-2019,2.0.19433,1
459,5050a470-6d03-44eb-ba00-5a2758d361af,Googlen käyttäjä,important,3,10-03-2019,2.0.19433,1
460,74879e7b-465c-454b-b2f4-3da52ee48fde,Googlen käyttäjä,"Not quite five stars, today there was a deficiency in the app here in Kouvola. The official notification of the rescue exercise could have come as a notification on the phone screen or in the bars, now it was only read inside the application. This way you won't necessarily notice the situation.",5,07-03-2019,2.0.19433,1
461,4c52961d-fc22-4d49-8667-543c90264d5c,Googlen käyttäjä,"Why does the application require rights, e.g. to browser history?",4,06-03-2019,2.0.19433,0
462,4e2c85e6-1c03-46c6-a166-0eb805e71fac,Googlen käyttäjä,Ok,1,27-02-2019,2.0.19433,1
463,f824d3d9-94e8-44ce-bf64-84e22c41464e,Googlen käyttäjä,everyone should have it,5,25-02-2019,1.2.9,0
464,e77cb985-0ac0-4489-a406-e2b39d343f7a,Googlen käyttäjä,can't update.nokia 5.android 9.,5,25-02-2019,2.0.19433,0
465,ba702403-8e88-487e-abb8-8018f6d306ce,Googlen käyttäjä,good,1,21-02-2019,1.2.9,1
