Review Id,User Name,Review,Rating,Date of Review,reviewCreatedVersion,Sentiment
,Rustto,"This worked well before, but after switching to iOS4 it no longer works. It can't find your location anymore. It's a shame, because the idea behind the app is great.",2,2010-10-31,<4.0.0,1
,LarsMartin,"17 kroner for an app you won't use more than maybe once is, in this case, absolutely great! These four can be the difference between life and death! And should you forget to use the app in a hurry, it can still be used during a normal call. :)",5,2010-10-18,<4.0.0,1
,Ottar Vassenden,Supporting with 17 measly kroner is worth the App. May it never be used by me ;-),5,2010-10-10,<4.0.0,1
,Førland,"If I should not be used for this app, or if I should forget to use it when the accident is over... at least it has been a pleasure to support the air ambulance with the few kroner it costs! Thank you for the great effort you make, and all the lives you save!!!!",5,2010-06-29,<4.0.0,1
,iPhone brukeren,"I think it's a great app, police and fire should have something similar. I hope it won't be used myself",5,2010-05-01,<4.0.0,1
,Telefonnerden,"Good to have when the accident happens, absolutely can save lives.",5,2010-04-28,<4.0.0,1
,Mahuns,"Very good, at the same time you support a good cause.",5,2010-04-25,<4.0.0,1
,MeBluesea,"So simple, so ingenious and not least so incredibly easy to use. NAF & KNA should write about this in their magazines so that it really gets the media coverage it needs to make people open their eyes.

Highly recommended",5,2010-04-16,<4.0.0,1
,Immortell,"Have been one of the first at an accident scene where small children were involved. The time you have at your disposal is extremely important to manage well, and you should avoid fooling around with looking for where you are. Download this one. Nobody plans to get into such a situation, but it's good to be prepared if it happens.",5,2010-04-12,<4.0.0,1
,AndreasNOR,"A ""must have"" app for all iPhone owners!

And NOK 17 for a good cause!",5,2010-04-12,<4.0.0,1
,Karlsen,"Bought this after missing it after coming first in a car accident in Oslo. Now that I first needed it, I didn't have it. Run to buy and hope you don't get used for it.",5,2010-04-10,<4.0.0,-1
,Grarest ,Very important app ,5,2010-04-09,<4.0.0,1
,HELI[OPS],Fabulous app.,5,2010-04-08,<4.0.0,1
,thomto,Brilliant app! This should have been mandatory for everyone on the move. Support the NLA and buy this app!!,5,2010-04-07,<4.0.0,1
,Bigal-kos,hope I never need to use it.,5,2010-04-07,<4.0.0,1
,Øie,"Quite strange actually - downloading an app I hope I NEVER need. Anyway, this seems like a very valuable app, should a serious accident occur where you are, both for others and for yourself. Download to support NLA!",5,2010-04-07,<4.0.0,1
,sba8585,"This has to be one of the most useful apps.
Very easy to use, as well as the fact that it can save lives!",5,2010-04-07,<4.0.0,1
,medlem,"Useful for me and those who have to try to find me if the accident is out!
Useful both out on a ski trip and on the country road!",5,2010-04-06,<4.0.0,1
,Post peregrino,This one was absolutely great!,5,2010-04-06,<4.0.0,1
,kurthj,Crash crash crash every time it starts. Help I'm dying!!!!!!!!!!!!!,1,2017-06-10,<4.0.0,-1
